[{
  "_id": {
    "$oid": "681daaa9de130bddf45fd066"
  },
  "sku": "124254",
  "brand": "North Beach",
  "count_unit": "Item",
  "department": "Specialty Cheese",
  "dimension_each": "L 1\" x W 1\" x H 1\"",
  "discount": "",
  "empty": false,
  "href": "https://shop.kimelo.com/sku/cheese-mozzarella-wmlm-feather-shred-nb-45-lb-124254/124254",
  "images": [
    "https://d3tlizm80tjdt4.cloudfront.net/remote_images/image/2114/small/b41784f854f03efedc29d73d0a248d0dac389d704b7101205d.jpg"
  ],
  "item_counts_each": 1,
  "name": "Cheese, Mozzarella, Wmlm, Feather Shred, Nb, 4/5 Lb - 124254",
  "popularity_order": 1,
  "price": 53.98,
  "pricePer": 2.7,
  "price_each": 53.98,
  "price_order": 38,
  "price_unit": "lb",
  "relateds": [],
  "showImage": "https://d3tlizm80tjdt4.cloudfront.net/remote_images/image/2114/small/b41784f854f03efedc29d73d0a248d0dac389d704b7101205d.jpg",
  "text": "The North Beach Cheese, Mozzarella, Wmlm, Feather Shred (SKU 124254) is a specialty cheese featured in the Specialty Cheese department. This product comes as 1 item per unit, with each unit weighing 20 lbs and having dimensions of L 1\" x W 1\" x H 1\". The current price for each unit is $53.98, which equals $2.70 per pound. There are no discounts available, and the item is in stock. The cheese has a price order rank of 38 and holds the top position in popularity. Reference and preview images are available at https://d3tlizm80tjdt4.cloudfront.net/remote_images/image/2114/small/b41784f854f03efedc29d73d0a248d0dac389d704b7101205d.jpg. More information can be found at https://shop.kimelo.com/sku/cheese-mozzarella-wmlm-feather-shred-nb-45-lb-124254/124254.",
  "weight_each": 20,
  "weight_unit": "lbs"
},
{
  "_id": {
    "$oid": "681daaaade130bddf45fd067"
  },
  "sku": "103674",
  "brand": "Schreiber",
  "count_unit": "Item",
  "department": "Sliced Cheese",
  "dimension_case": "L 1\" x W 1\" x H 1\"",
  "dimension_each": "L 1\" x W 1\" x H 1\"",
  "discount": "",
  "empty": false,
  "href": "https://shop.kimelo.com/sku/cheese-american-120-slice-yellow-4-5-lb-103674/103674",
  "images": [
    "https://d3tlizm80tjdt4.cloudfront.net/image/15196/image/sm-af4d520ed6ba1c0a2c2dbddaffd35ce4.png"
  ],
  "item_counts_case": 4,
  "item_counts_each": 1,
  "name": "Cheese, American, 120 Slice, Yellow, (4) 5 Lb - 103674",
  "popularity_order": 2,
  "price": 16.76,
  "pricePer": 3.35,
  "price_case": 67.04,
  "price_each": 16.76,
  "price_order": 83,
  "price_unit": "lb",
  "relateds": [
    "100014"
  ],
  "showImage": "https://d3tlizm80tjdt4.cloudfront.net/image/15196/image/sm-af4d520ed6ba1c0a2c2dbddaffd35ce4.png",
  "text": "Cheese, American, 120 Slice, Yellow, (4) 5 Lb - 103674 is a sliced cheese from the brand Schreiber, belonging to the Sliced Cheese department. Each case contains 4 items, with each item weighing 1.2875 lbs, for a total case weight of 5.15 lbs. The dimensions for both case and each item are L 1\" x W 1\" x H 1\". The price is $16.76 per item or $67.04 per case, with a price per pound of $3.35/lb. The cheese has SKU 103674 and is currently available in stock. This product has a related item with SKU 100014 and ranks 83rd in price order and 2nd in popularity order. You can view the cheese at the following link: https://shop.kimelo.com/sku/cheese-american-120-slice-yellow-4-5-lb-103674/103674, and a preview image is available at https://d3tlizm80tjdt4.cloudfront.net/image/15196/image/sm-af4d520ed6ba1c0a2c2dbddaffd35ce4.png.",
  "weight_case": 5.15,
  "weight_each": 1.2875,
  "weight_unit": "lbs"
},
{
  "_id": {
    "$oid": "681daaaade130bddf45fd068"
  },
  "sku": "106832",
  "brand": "Cheswick",
  "count_unit": "Item",
  "department": "Shredded Cheese",
  "dimension_case": "L 1\" x W 1\" x H 1\"",
  "dimension_each": "L 1\" x W 1\" x H 1\"",
  "discount": "",
  "empty": false,
  "href": "https://shop.kimelo.com/sku/cheese-cheddar-shredded-fancy-mild-4-106832/106832",
  "images": [
    "https://d3tlizm80tjdt4.cloudfront.net/image/3523/image/sm-8c0633f6cbe02f5223ebf8dccd214838.jpg",
    "https://d3tlizm80tjdt4.cloudfront.net/image/15193/image/sm-dba02abeba78ee707501f521a0557481.png",
    "https://d3tlizm80tjdt4.cloudfront.net/image/11508/image/sm-055bb8294fde524216aa47e922a75c1c.jpeg"
  ],
  "item_counts_case": 4,
  "item_counts_each": 1,
  "name": "Cheese, Cheddar, Shredded, Fancy, Mild, (4) - 106832",
  "popularity_order": 3,
  "price": 16.46,
  "pricePer": 3.29,
  "price_case": 65.84,
  "price_each": 16.46,
  "price_order": 85,
  "price_unit": "lb",
  "relateds": [
    "103600",
    "103670"
  ],
  "showImage": "https://d3tlizm80tjdt4.cloudfront.net/image/15193/image/sm-dba02abeba78ee707501f521a0557481.png",
  "text": "Cheese, Cheddar, Shredded, Fancy, Mild (SKU: 106832) is a product by Cheswick in the Shredded Cheese department. Each case contains 4 individual items, with each item weighing 1.25 lbs and the total case weight being 5 lbs. The dimensions for both each unit and each case are L 1\" x W 1\" x H 1\". The price is $16.46 per item and $65.84 per case, with a price per pound of $3.29. This cheese is related to items with SKUs 103600 and 103670, and comes with multiple reference images for preview. It is currently available in the shop and holds a price order ranking of 85 and a popularity order ranking of 3. For more information or to purchase, visit https://shop.kimelo.com/sku/cheese-cheddar-shredded-fancy-mild-4-106832/106832.",
  "weight_case": 5,
  "weight_each": 1.25,
  "weight_unit": "lbs"
},
{
  "_id": {
    "$oid": "681daaaade130bddf45fd069"
  },
  "sku": "103600",
  "brand": "California Select Farms",
  "count_unit": "Item",
  "department": "Sliced Cheese",
  "dimension_case": "L 1\" x W 1\" x H 1\"",
  "dimension_each": "L 1\" x W 1\" x H 1\"",
  "discount": "",
  "empty": false,
  "href": "https://shop.kimelo.com/sku/cheese-cheddar-mild-sliced-8-103600/103600",
  "images": [
    "https://d3tlizm80tjdt4.cloudfront.net/image/8965/image/sm-137bd810e22f0b816f7a749f30bb60f4.jpeg"
  ],
  "item_counts_case": 8,
  "item_counts_each": 1,
  "name": "Cheese, Cheddar, Mild, Sliced, (8) - 103600",
  "popularity_order": 5,
  "price": 6.89,
  "pricePer": 4.59,
  "price_case": 55.12,
  "price_each": 6.89,
  "price_order": 94,
  "price_unit": "lb",
  "relateds": [
    "103603",
    "106832"
  ],
  "showImage": "https://d3tlizm80tjdt4.cloudfront.net/image/8965/image/sm-137bd810e22f0b816f7a749f30bb60f4.jpeg",
  "text": "Cheese, Cheddar, Mild, Sliced, (8) - 103600 is a mild cheddar cheese offered by California Select Farms under the Sliced Cheese department. It is available in cases containing 8 individual items, with each item weighing 0.1875 lbs and each case totaling 1.5 lbs; the dimensions for both the case and each item are L 1\" x W 1\" x H 1\". The cheese comes with a preview image at https://d3tlizm80tjdt4.cloudfront.net/image/8965/image/sm-137bd810e22f0b816f7a749f30bb60f4.jpeg. The price is $6.89 per item and $55.12 per case, with a price per pound of $4.59. Related SKUs for this cheese are 103603 and 106832. The SKU for this product is 103600, and it is currently in stock (empty: false). More information can be found at https://shop.kimelo.com/sku/cheese-cheddar-mild-sliced-8-103600/103600. This cheese ranks 94th by price and 5th by popularity.",
  "weight_case": 1.5,
  "weight_each": 0.1875,
  "weight_unit": "lbs"
},
{
  "_id": {
    "$oid": "681daaabde130bddf45fd06a"
  },
  "sku": "111522",
  "brand": "Galbani",
  "count_unit": "Item",
  "department": "Crumbled, Cubed, Grated, Shaved",
  "dimension_case": "L 1\" x W 1\" x H 1\"",
  "dimension_each": "L 1\" x W 1\" x H 1\"",
  "discount": "",
  "empty": false,
  "href": "https://shop.kimelo.com/sku/cheese-parmesan-grated-imported-4-5-lb-111522/111522",
  "images": [
    "https://d3tlizm80tjdt4.cloudfront.net/image/10794/image/sm-313ae66972cd7064da6bcf09c337ae5a.png"
  ],
  "item_counts_case": 4,
  "item_counts_each": 1,
  "name": "Cheese, Parmesan, Grated, Imported, (4) 5 Lb - 111522",
  "popularity_order": 6,
  "price": 30.18,
  "pricePer": 6.04,
  "price_case": 120.72,
  "price_each": 30.18,
  "price_order": 63,
  "price_unit": "lb",
  "relateds": [
    "106816",
    "112306"
  ],
  "showImage": "https://d3tlizm80tjdt4.cloudfront.net/image/10794/image/sm-313ae66972cd7064da6bcf09c337ae5a.png",
  "text": "Cheese, Parmesan, Grated, Imported (SKU: 111522) is offered by the brand Galbani and belongs to the \"Crumbled, Cubed, Grated, Shaved\" cheese category. This product comes either as a single item or in a case of 4, with each unit weighing 1.25 lbs and a case totaling 5 lbs; both units have dimensions of L 1\" x W 1\" x H 1\". The price is $30.18 for each and $120.72 per case, with a cost of $6.04 per pound. There is currently no discount available. This cheese is in stock and can be viewed at the provided image URL or purchased via https://shop.kimelo.com/sku/cheese-parmesan-grated-imported-4-5-lb-111522/111522. Related cheeses include products with SKUs 106816 and 112306. It ranks 63rd by price and 6th by popularity.",
  "weight_case": 5,
  "weight_each": 1.25,
  "weight_unit": "lbs"
},
{
  "_id": {
    "$oid": "681daaabde130bddf45fd06b"
  },
  "sku": "106816",
  "brand": "Galbani",
  "count_unit": "Item",
  "department": "Crumbled, Cubed, Grated, Shaved",
  "dimension_case": "L 1\" x W 1\" x H 1\"",
  "dimension_each": "L 1\" x W 1\" x H 1\"",
  "discount": "",
  "empty": false,
  "href": "https://shop.kimelo.com/sku/cheese-parmesan-shaved-4-5-lb-106816/106816",
  "images": [
    "https://d3tlizm80tjdt4.cloudfront.net/image/2865/image/sm-7f83700059c075a212d5756e9c4e7073.jpg"
  ],
  "item_counts_case": 4,
  "item_counts_each": 1,
  "name": "Cheese, Parmesan, Shaved, (4) 5 Lb - 106816",
  "popularity_order": 7,
  "price": 26.44,
  "pricePer": 5.29,
  "price_case": 105.76,
  "price_each": 26.44,
  "price_order": 69,
  "price_unit": "lb",
  "relateds": [
    "112306",
    "111522"
  ],
  "showImage": "https://d3tlizm80tjdt4.cloudfront.net/image/2865/image/sm-7f83700059c075a212d5756e9c4e7073.jpg",
  "text": "The \"Cheese, Parmesan, Shaved, (4) 5 Lb - 106816\" by Galbani is a shaved parmesan cheese available in the \"Crumbled, Cubed, Grated, Shaved\" department. Each case contains 4 items, and each item weighs 1.25 lbs, making the total case weight 5 lbs. The dimensions for both each and case are L 1\" x W 1\" x H 1\". The price is $26.44 per item and $105.76 per case, with a price per pound of $5.29. Its SKU is 106816, and it is currently available for purchase. There are related products with SKUs 112306 and 111522. For more information or to purchase, visit https://shop.kimelo.com/sku/cheese-parmesan-shaved-4-5-lb-106816/106816.",
  "weight_case": 5,
  "weight_each": 1.25,
  "weight_unit": "lbs"
},
{
  "_id": {
    "$oid": "681daaabde130bddf45fd06c"
  },
  "sku": "108718",
  "brand": "Galbani",
  "count_unit": "Item",
  "department": "Specialty Cheese",
  "dimension_case": "L 1\" x W 1\" x H 1\"",
  "dimension_each": "L 1\" x W 1\" x H 1\"",
  "discount": "",
  "empty": false,
  "href": "https://shop.kimelo.com/sku/cheese-ricotta-4-5lb-108718/108718",
  "images": [
    "https://d3tlizm80tjdt4.cloudfront.net/image/15218/image/sm-466292604c156f994ceac17cbcf40f9e.png",
    "https://d3tlizm80tjdt4.cloudfront.net/image/6471/image/sm-bda6386bbd05798cc8a74996b2cc845a.jpg",
    "https://d3tlizm80tjdt4.cloudfront.net/image/6472/image/sm-408b1ffb5afd1e90810c60ec8e96c810.jpg"
  ],
  "item_counts_case": 4,
  "item_counts_each": 1,
  "name": "Cheese, Ricotta, (4) 5lb - 108718",
  "popularity_order": 8,
  "price": 16.89,
  "pricePer": 3.38,
  "price_case": 67.56,
  "price_each": 16.89,
  "price_order": 82,
  "price_unit": "lb",
  "relateds": [
    "107599"
  ],
  "showImage": "https://d3tlizm80tjdt4.cloudfront.net/image/15218/image/sm-466292604c156f994ceac17cbcf40f9e.png",
  "text": "Cheese, Ricotta (SKU: 108718) is a specialty cheese from the Galbani brand. It is available in a case containing 4 items, each with a weight of 1.25 lbs, totaling 5 lbs per case. The price per case is $67.56, while each individual item costs $16.89, with a price per pound of $3.38. The dimensions for both the case and each item are L 1\" x W 1\" x H 1\". There are multiple reference images for this cheese, and its popularity order is 8, with a price order of 82. Ricotta is related to SKU 107599 and is currently in stock. More details can be found at https://shop.kimelo.com/sku/cheese-ricotta-4-5lb-108718/108718.",
  "weight_case": 5,
  "weight_each": 1.25,
  "weight_unit": "lbs"
},
{
  "_id": {
    "$oid": "681daaacde130bddf45fd06d"
  },
  "sku": "103663",
  "brand": "Philadelphia",
  "count_unit": "Item",
  "department": "Cheese Loaf",
  "dimension_case": "L 1\" x W 1\" x H 1\"",
  "dimension_each": "L 1\" x W 1\" x H 1\"",
  "discount": "",
  "empty": false,
  "href": "https://shop.kimelo.com/sku/cheese-cream-loaf-philadelphia-6-3-lb-103663/103663",
  "images": [
    "https://d3tlizm80tjdt4.cloudfront.net/image/1545/image/sm-57a0a958f4f4717c1bba1b6ea1376e12.jpg",
    "https://d3tlizm80tjdt4.cloudfront.net/image/1544/image/sm-b2bb50a2b1ae90153c2401ff9f0214df.jpg"
  ],
  "item_counts_case": 6,
  "item_counts_each": 1,
  "name": "Cheese, Cream, Loaf, Philadelphia, (6) 3 Lb - 103663",
  "popularity_order": 9,
  "price": 16.13,
  "pricePer": 5.38,
  "price_case": 96.78,
  "price_each": 16.13,
  "price_order": 87,
  "price_unit": "lb",
  "relateds": [
    "103662",
    "112699"
  ],
  "showImage": "https://d3tlizm80tjdt4.cloudfront.net/image/1544/image/sm-b2bb50a2b1ae90153c2401ff9f0214df.jpg",
  "text": "Cheese, Cream, Loaf, Philadelphia (SKU: 103663) is a specialty cheese loaf from the Philadelphia brand. It belongs to the Cheese Loaf department and is available as a case containing 6 items or as a single item. Each unit measures L 1\" x W 1\" x H 1\"; a case weighs 3 lbs, while each individual loaf is 0.5 lbs. The price is $96.78 per case or $16.13 per loaf, with a price per pound of $5.38. Related products include SKUs 103662 and 112699. This cheese is currently available for purchase and can be viewed at https://shop.kimelo.com/sku/cheese-cream-loaf-philadelphia-6-3-lb-103663/103663. For reference, there are multiple product images provided. It ranks 87th by price and 9th in popularity among cheeses in this shop.",
  "weight_case": 3,
  "weight_each": 0.5,
  "weight_unit": "lbs"
},
{
  "_id": {
    "$oid": "681daaacde130bddf45fd06e"
  },
  "sku": "103664",
  "brand": "Packer",
  "count_unit": "Item",
  "department": "Shredded Cheese",
  "dimension_case": "L 1\" x W 1\" x H 1\"",
  "dimension_each": "L 1\" x W 1\" x H 1\"",
  "discount": "",
  "empty": false,
  "href": "https://shop.kimelo.com/sku/cheese-shredded-jack-cheddar-blend-fancy-4-5-lb-103664/103664",
  "images": [
    "https://d3tlizm80tjdt4.cloudfront.net/remote_images/image/7672/small/63a1d4191c5e3258376922c1599c780ef012ec6bf3828fa409.jpg",
    "https://d3tlizm80tjdt4.cloudfront.net/image/1466/image/sm-9dc182a80808a1c180aad5abe924c572.jpg"
  ],
  "item_counts_case": 4,
  "item_counts_each": 1,
  "name": "Cheese, Shredded, Jack & Cheddar Blend, Fancy, (4) 5 Lb - 103664",
  "popularity_order": 10,
  "price": 14.71,
  "pricePer": 2.94,
  "price_case": 58.84,
  "price_each": 14.71,
  "price_order": 88,
  "price_unit": "lb",
  "relateds": [
    "123784"
  ],
  "showImage": "https://d3tlizm80tjdt4.cloudfront.net/remote_images/image/7672/small/63a1d4191c5e3258376922c1599c780ef012ec6bf3828fa409.jpg",
  "text": "Cheese, Shredded, Jack & Cheddar Blend, Fancy, (4) 5 Lb - 103664 is a shredded cheese blend from the Packer brand, categorized under Shredded Cheese. Each case contains 4 individual items, with each item weighing 1.25 lbs, totaling 5 lbs per case. The dimensions for both each unit and the case are L 1\" x W 1\" x H 1\". The price is $14.71 per item and $58.84 per case, with a price per pound of $2.94/lb. This cheese has related product SKU 123784, and its own SKU is 103664. There are multiple images available, and it can be viewed or purchased at https://shop.kimelo.com/sku/cheese-shredded-jack-cheddar-blend-fancy-4-5-lb-103664/103664. No current discounts are offered, and the product is available in stock, ranked 88th by price and 10th by popularity.",
  "weight_case": 5,
  "weight_each": 1.25,
  "weight_unit": "lbs"
},
{
  "_id": {
    "$oid": "681daaadde130bddf45fd06f"
  },
  "sku": "124829",
  "brand": "Cal Premium",
  "count_unit": "Item",
  "department": "Sliced Cheese",
  "dimension_case": "L 1\" x W 1\" x H 1\"",
  "dimension_each": "L 1\" x W 1\" x H 1\"",
  "discount": "",
  "empty": false,
  "href": "https://shop.kimelo.com/sku/cheese-jack-pepper-sliced-8-15-lb-124829/124829",
  "images": [
    "https://d3tlizm80tjdt4.cloudfront.net/remote_images/image/5723/small/63b0ef7755de74914c5a50da256581d0721f73912ee4923b21.jpg"
  ],
  "item_counts_case": 8,
  "item_counts_each": 1,
  "name": "Cheese, Jack Pepper, Sliced, (8) 1.5 Lb 124829",
  "popularity_order": 11,
  "price": 6.72,
  "pricePer": 4.48,
  "price_case": 53.76,
  "price_each": 6.72,
  "price_order": 95,
  "price_unit": "lb",
  "relateds": [
    "103672",
    "123794",
    "103599",
    "103672",
    "123794",
    "103599",
    "103672",
    "123794"
  ],
  "showImage": "https://d3tlizm80tjdt4.cloudfront.net/remote_images/image/5723/small/63b0ef7755de74914c5a50da256581d0721f73912ee4923b21.jpg",
  "text": "Cheese, Jack Pepper, Sliced (SKU: 124829) is a sliced cheese product from the brand Cal Premium, categorized under \"Sliced Cheese.\" Each item weighs 0.1875 lbs, and a case includes 8 items for a total case weight of 1.5 lbs. The item dimensions are L 1\" x W 1\" x H 1\" for both each and case units. The price is $6.72 for each item and $53.76 per case, with a cost of $4.48 per pound. This cheese is related to products with SKUs 103672, 123794, and 103599. It is currently available for purchase and ranks 95th in price order and 11th in popularity order. For more details or to buy, visit the provided link.",
  "weight_case": 1.5,
  "weight_each": 0.1875,
  "weight_unit": "lbs"
},
{
  "_id": {
    "$oid": "681daaadde130bddf45fd070"
  },
  "sku": "374574",
  "brand": "Gopi",
  "count_unit": "Item",
  "department": "Sliced Cheese",
  "dimension_each": "L 1\" x W 1\" x H 1\"",
  "discount": "",
  "empty": false,
  "href": "https://shop.kimelo.com/sku/cheese-paneer-gopi-45-lb/374574",
  "images": [
    "https://d3tlizm80tjdt4.cloudfront.net/remote_images/image/10816/small/2048920d241626bd3bad46e85780c82aa9ba11b23f92f26222.jpg"
  ],
  "item_counts_each": 1,
  "name": "Cheese, Paneer, Gopi, 4/5 Lb",
  "popularity_order": 12,
  "price": 75.1,
  "pricePer": 3.76,
  "price_each": 75.1,
  "price_order": 28,
  "price_unit": "Lb",
  "relateds": [],
  "showImage": "https://d3tlizm80tjdt4.cloudfront.net/remote_images/image/10816/small/2048920d241626bd3bad46e85780c82aa9ba11b23f92f26222.jpg",
  "text": "Cheese, Paneer, Gopi, 4/5 Lb is a specialty product from the Gopi brand, listed under the Sliced Cheese department. Each unit contains 1 item with dimensions of L 1\" x W 1\" x H 1\", and a weight of 20 lbs. The price for each unit is $75.10, and the price per pound is $3.76. There are no discounts currently available for this product, and it is in stock. The SKU for this cheese is 374574, and it ranks 28th in price order and 12th in popularity order. For more details or to purchase, visit https://shop.kimelo.com/sku/cheese-paneer-gopi-45-lb/374574.",
  "weight_each": 20,
  "weight_unit": "lbs"
},
{
  "_id": {
    "$oid": "681daaadde130bddf45fd071"
  },
  "sku": "103670",
  "brand": "Cheswick",
  "count_unit": "Item",
  "department": "Cheese Loaf",
  "dimension_case": "L 1\" x W 1\" x H 1\"",
  "dimension_each": "L 1\" x W 1\" x H 1\"",
  "discount": "",
  "empty": false,
  "href": "https://shop.kimelo.com/sku/cheese-cheddar-mild-loaf-8-5-lb-103670/103670",
  "images": [
    "https://d3tlizm80tjdt4.cloudfront.net/image/11595/image/sm-a149c106d663df481f081d8fa47bcf0f.jpeg",
    "https://d3tlizm80tjdt4.cloudfront.net/image/2239/image/sm-97cfe4b265d24acb4747c475560701cb.png"
  ],
  "item_counts_case": 8,
  "item_counts_each": 1,
  "name": "Cheese, Cheddar, Mild, Loaf, (8) 5 Lb - 103670",
  "popularity_order": 13,
  "price": 16.99,
  "pricePer": 3.4,
  "price_case": 135.92,
  "price_each": 16.99,
  "price_order": 81,
  "price_unit": "lb",
  "relateds": [
    "106815",
    "106832",
    "103600",
    "106815",
    "106832",
    "103600",
    "106815",
    "106832"
  ],
  "showImage": "https://d3tlizm80tjdt4.cloudfront.net/image/11595/image/sm-a149c106d663df481f081d8fa47bcf0f.jpeg",
  "text": "Cheese, Cheddar, Mild, Loaf, (8) 5 Lb - 103670 is a mild cheddar cheese product from the Cheswick brand, categorized under Cheese Loaf. Each case contains 8 items, with each loaf weighing 0.625 lbs and the total case weight being 5 lbs. The dimensions for both each item and the case are L 1\" x W 1\" x H 1\". The price for an individual loaf is $16.99, while a case is priced at $135.92, equating to $3.40 per pound. Reference images are available, and related cheeses have SKUs 106815, 106832, and 103600. This product is currently in stock, identified by SKU 103670, and can be found at [this link](https://shop.kimelo.com/sku/cheese-cheddar-mild-loaf-8-5-lb-103670/103670). It ranks 81st in price order and 13th in popularity, with no current discounts available.",
  "weight_case": 5,
  "weight_each": 0.625,
  "weight_unit": "lbs"
},
{
  "_id": {
    "$oid": "681daaaede130bddf45fd072"
  },
  "sku": "123341",
  "brand": "President",
  "count_unit": "Item",
  "department": "Specialty Cheese",
  "dimension_each": "L 1\" x W 1\" x H 1\"",
  "discount": "",
  "empty": false,
  "href": "https://shop.kimelo.com/sku/cheese-feta-crumbles-president-25-lb-123341/123341",
  "images": [
    "https://d3tlizm80tjdt4.cloudfront.net/image/17447/image/sm-b7f1d5ebed658c7a48b315af49bb5e0d.png"
  ],
  "item_counts_each": 1,
  "name": "Cheese, Feta, Crumbles, President, 2/5 Lb - 123341",
  "popularity_order": 14,
  "price": 44.11,
  "pricePer": 4.41,
  "price_each": 44.11,
  "price_order": 50,
  "price_unit": "lb",
  "relateds": [
    "123797",
    "124006"
  ],
  "showImage": "https://d3tlizm80tjdt4.cloudfront.net/image/17447/image/sm-b7f1d5ebed658c7a48b315af49bb5e0d.png",
  "text": "Cheese, Feta, Crumbles, President, 2/5 Lb - 123341 is a specialty cheese offered by the brand President. It is categorized under Specialty Cheese and comes as one item per unit, with each unit weighing 10 lbs and measuring L 1\" x W 1\" x H 1\". The price for each is $44.11, translating to $4.41 per pound. This cheese product is associated with related SKUs 123797 and 124006 and can be found using the SKU 123341. It is available for purchase at https://shop.kimelo.com/sku/cheese-feta-crumbles-president-25-lb-123341/123341, and is currently in stock with no active discount. This cheese ranks 50th by price and 14th by popularity among similar products.",
  "weight_each": 10,
  "weight_unit": "lbs"
},
{
  "_id": {
    "$oid": "681daaaede130bddf45fd073"
  },
  "sku": "107599",
  "brand": "Belgioioso",
  "count_unit": "Item",
  "department": "Specialty Cheese",
  "dimension_case": "L 1\" x W 1\" x H 1\"",
  "dimension_each": "L 1\" x W 1\" x H 1\"",
  "discount": "",
  "empty": false,
  "href": "https://shop.kimelo.com/sku/cheese-mascarpone-tub-belgioioso-4-5-lb-107599/107599",
  "images": [
    "https://d3tlizm80tjdt4.cloudfront.net/image/17540/image/sm-c373691cb060f68e4cc8b4904a692eda.png"
  ],
  "item_counts_case": 4,
  "item_counts_each": 1,
  "name": "Cheese, Mascarpone, Tub, Belgioioso, (4) 5 Lb - 107599",
  "popularity_order": 15,
  "price": 29.72,
  "pricePer": 5.94,
  "price_case": 118.88,
  "price_each": 29.72,
  "price_order": 65,
  "price_unit": "lb",
  "relateds": [
    "108718"
  ],
  "showImage": "https://d3tlizm80tjdt4.cloudfront.net/image/17540/image/sm-c373691cb060f68e4cc8b4904a692eda.png",
  "text": "Cheese, Mascarpone, Tub, Belgioioso, (4) 5 Lb - 107599 is a specialty cheese from the brand Belgioioso. It belongs to the Specialty Cheese department and is available in cases, with each case containing 4 tubs and each tub weighing 1.25 lbs for a total case weight of 5 lbs. The cheese is packaged in tubs with dimensions of L 1\" x W 1\" x H 1\" per item. The price for each tub is $29.72, and a full case costs $118.88, with a price per pound of $5.94. This cheese has a related SKU of 108718 and is currently in stock. The SKU for this item is 107599. For more information or to purchase, you can visit https://shop.kimelo.com/sku/cheese-mascarpone-tub-belgioioso-4-5-lb-107599/107599.",
  "weight_case": 5,
  "weight_each": 1.25,
  "weight_unit": "lbs"
},
{
  "_id": {
    "$oid": "681daaaede130bddf45fd074"
  },
  "sku": "125731",
  "brand": "Galbani",
  "count_unit": "Item",
  "department": "Cheese Loaf",
  "dimension_each": "L 1\" x W 1\" x H 1\"",
  "discount": "",
  "empty": false,
  "href": "https://shop.kimelo.com/sku/cheese-mozzarella-wmlm-loaf-professionale-85-lb-125731/125731",
  "images": [
    "https://d3tlizm80tjdt4.cloudfront.net/remote_images/image/7215/small/0a7da17fd94fe5c52868137e402c2fb20947dba2f4b452a049.jpg",
    "https://d3tlizm80tjdt4.cloudfront.net/remote_images/image/7711/small/98449d9e2b7395c71eea2dfabcd07b4b9e2ade7f6e52357a69.jpg"
  ],
  "item_counts_each": 1,
  "name": "Cheese, Mozzarella, Wmlm, Loaf, Professionale, 8/5 Lb 125731",
  "popularity_order": 16,
  "price": 98.2,
  "pricePer": 2.46,
  "price_each": 98.2,
  "price_order": 20,
  "price_unit": "lb",
  "relateds": [],
  "showImage": "https://d3tlizm80tjdt4.cloudfront.net/remote_images/image/7215/small/0a7da17fd94fe5c52868137e402c2fb20947dba2f4b452a049.jpg",
  "text": "The Cheese, Mozzarella, Wmlm, Loaf, Professionale, 8/5 Lb (SKU: 125731) is a specialty cheese loaf from the brand Galbani, categorized under Cheese Loaf. Each item weighs 40 lbs and has dimensions of L 1\" x W 1\" x H 1\". The product is available at a price of $98.20 each, which comes to $2.46 per pound. There are two reference images included for this cheese, accessible through provided URLs. No discount is currently offered. This cheese is available in stock and can be viewed or purchased at the provided link. Its price order is 20 among cheeses, while its popularity ranks at 16.",
  "weight_each": 40,
  "weight_unit": "lbs"
},
{
  "_id": {
    "$oid": "681daaafde130bddf45fd075"
  },
  "sku": "107598",
  "brand": "Belgioioso",
  "count_unit": "Item",
  "department": "Crumbled, Cubed, Grated, Shaved",
  "dimension_case": "L 1\" x W 1\" x H 1\"",
  "dimension_each": "L 1\" x W 1\" x H 1\"",
  "discount": "",
  "empty": false,
  "href": "https://shop.kimelo.com/sku/cheese-gorgonzola-crumbles-86464-2-5-lb-107598/107598",
  "images": [
    "https://d3tlizm80tjdt4.cloudfront.net/image/5982/image/sm-9aa3ae766c94f5a2fcc8f244a97460de.jpg",
    "https://d3tlizm80tjdt4.cloudfront.net/image/5983/image/sm-8762cc632e245f4af8d15df5fda8ba63.jpg"
  ],
  "item_counts_case": 2,
  "item_counts_each": 1,
  "name": "Cheese, Gorgonzola, Crumbles, 86464, (2) 5 Lb - 107598",
  "popularity_order": 17,
  "price": 24.53,
  "pricePer": 4.91,
  "price_case": 49.06,
  "price_each": 24.53,
  "price_order": 71,
  "price_unit": "lb",
  "relateds": [],
  "showImage": "https://d3tlizm80tjdt4.cloudfront.net/image/5982/image/sm-9aa3ae766c94f5a2fcc8f244a97460de.jpg",
  "text": "Belgioioso Cheese Gorgonzola Crumbles, SKU 107598, is offered in the Crumbled, Cubed, Grated, Shaved department. Each case contains two items, with each item weighing 2.5 lbs for a total case weight of 5 lbs. Both the case and each unit have dimensions of 1\" x 1\" x 1\". The price is $24.53 per item and $49.06 per case, with a price per pound of $4.91. There is no discount currently available, and this product is in stock. Example images can be viewed at https://d3tlizm80tjdt4.cloudfront.net/image/5982/image/sm-9aa3ae766c94f5a2fcc8f244a97460de.jpg and https://d3tlizm80tjdt4.cloudfront.net/image/5983/image/sm-8762cc632e245f4af8d15df5fda8ba63.jpg. For more information, visit https://shop.kimelo.com/sku/cheese-gorgonzola-crumbles-86464-2-5-lb-107598/107598. This cheese ranks 71st in price and 17th in popularity.",
  "weight_case": 5,
  "weight_each": 2.5,
  "weight_unit": "lbs"
},
{
  "_id": {
    "$oid": "681daaafde130bddf45fd076"
  },
  "sku": "109240",
  "brand": "Royal Mahout",
  "count_unit": "Item",
  "department": "Specialty Cheese",
  "dimension_case": "L 1\" x W 1\" x H 1\"",
  "dimension_each": "L 1\" x W 1\" x H 1\"",
  "discount": "",
  "empty": false,
  "href": "https://shop.kimelo.com/sku/cheese-indian-paneer-bulk-fresh-loaf-4-109240/109240",
  "images": [
    "https://d3tlizm80tjdt4.cloudfront.net/image/14820/image/sm-d0fbe266cac5dbbfe601de287ad60344.png",
    "https://d3tlizm80tjdt4.cloudfront.net/image/13821/image/sm-650582e6594da277fcb3f8b881528025.png"
  ],
  "item_counts_case": 4,
  "item_counts_each": 1,
  "name": "Cheese, Indian Paneer Bulk Fresh Loaf (4) 109240",
  "popularity_order": 18,
  "price": 20.58,
  "pricePer": 4.12,
  "price_case": 82.32,
  "price_each": 20.58,
  "price_order": 75,
  "price_unit": "lb",
  "relateds": [],
  "showImage": "https://d3tlizm80tjdt4.cloudfront.net/image/14820/image/sm-d0fbe266cac5dbbfe601de287ad60344.png",
  "text": "Cheese, Indian Paneer Bulk Fresh Loaf (SKU 109240) is a specialty cheese from the brand Royal Mahout. It is available in both individual units and cases, with each item weighing 1.3125 lbs and a case containing 4 items totaling 5.25 lbs. The dimensions for both each unit and case are L 1\" x W 1\" x H 1\". The price is $20.58 per item or $82.32 per case, and the cost comes to $4.12 per pound. This product can be found in the Specialty Cheese department and is currently in stock. Multiple reference images are provided, showcasing the cheese's appearance. For more details or to make a purchase, visit https://shop.kimelo.com/sku/cheese-indian-paneer-bulk-fresh-loaf-4-109240/109240. This cheese ranks 75th in price order and 18th in popularity, and there are currently no discounts or related products listed.",
  "weight_case": 5.25,
  "weight_each": 1.3125,
  "weight_unit": "lbs"
},
{
  "_id": {
    "$oid": "681daab0de130bddf45fd077"
  },
  "sku": "103601",
  "brand": "California Select Farms",
  "count_unit": "Item",
  "department": "Sliced Cheese",
  "dimension_case": "L 1\" x W 1\" x H 1\"",
  "dimension_each": "L 1\" x W 1\" x H 1\"",
  "discount": "",
  "empty": false,
  "href": "https://shop.kimelo.com/sku/cheese-provolone-sliced-8-15-lb-103601/103601",
  "images": [
    "https://d3tlizm80tjdt4.cloudfront.net/image/8966/image/sm-0ad8abe6c7be4ec1371aa99b8a1fe80d.jpeg",
    "https://d3tlizm80tjdt4.cloudfront.net/image/13531/image/sm-ae2f39087df7cbc9782ef2cc89adff7f.png"
  ],
  "item_counts_case": 8,
  "item_counts_each": 1,
  "name": "Cheese, Provolone, Sliced, (8) 1.5 Lb - 103601",
  "popularity_order": 19,
  "price": 6.58,
  "pricePer": 4.39,
  "price_case": 52.64,
  "price_each": 6.58,
  "price_order": 96,
  "price_unit": "lb",
  "relateds": [],
  "showImage": "https://d3tlizm80tjdt4.cloudfront.net/image/8966/image/sm-0ad8abe6c7be4ec1371aa99b8a1fe80d.jpeg",
  "text": "Cheese, Provolone, Sliced, (8) 1.5 Lb - 103601 is a sliced cheese from the brand California Select Farms under the Sliced Cheese department. Each CASE contains 8 items, and each item weighs 0.1875 lbs, while the CASE has a total weight of 1.5 lbs. The dimensions for both the CASE and EACH are L 1\" x W 1\" x H 1\". The price is $6.58 for EACH and $52.64 for the CASE, with a price per pound of $4.39/lb. This cheese is available for purchase and does not currently have any discounts. The Stock Keeping Unit (SKU) is 103601, and it ranks 96th in price and 19th in popularity. For more information, visit https://shop.kimelo.com/sku/cheese-provolone-sliced-8-15-lb-103601/103601. Reference images can be found at the provided URLs.",
  "weight_case": 1.5,
  "weight_each": 0.1875,
  "weight_unit": "lbs"
},
{
  "_id": {
    "$oid": "681daab0de130bddf45fd078"
  },
  "sku": "124006",
  "brand": "Estia",
  "count_unit": "Item",
  "department": "Specialty Cheese",
  "dimension_each": "L 1\" x W 1\" x H 1\"",
  "discount": "",
  "empty": false,
  "href": "https://shop.kimelo.com/sku/cheese-feta-rbst-free-estia-24-lb-124006/124006",
  "images": [
    "https://d3tlizm80tjdt4.cloudfront.net/remote_images/image/2271/small/7de5ff58f2fa420e59ed1a97ee95b035b5f2ecaaba98eada2b.jpg"
  ],
  "item_counts_each": 1,
  "name": "Cheese, Feta, Rbst Free, Estia, 24 Lb 124006",
  "popularity_order": 20,
  "price": 110.02,
  "pricePer": 4.58,
  "price_each": 110.02,
  "price_order": 11,
  "price_unit": "lb",
  "relateds": [
    "123797",
    "106845"
  ],
  "showImage": "https://d3tlizm80tjdt4.cloudfront.net/remote_images/image/2271/small/7de5ff58f2fa420e59ed1a97ee95b035b5f2ecaaba98eada2b.jpg",
  "text": "Cheese, Feta, Rbst Free by Estia is a specialty cheese offered in a 24 lb unit. Each item has dimensions of L 1\" x W 1\" x H 1\" and weighs 24 lbs. The price for each unit is $110.02, with a cost of $4.58 per pound. This cheese can be found using SKU 124006 and is currently available for purchase at the provided link. There are related cheeses with SKUs 123797 and 106845. The product is ranked 11th in price order and 20th in popularity order within its category. No discounts are currently available for this cheese.",
  "weight_each": 24,
  "weight_unit": "lbs"
},
{
  "_id": {
    "$oid": "681daab0de130bddf45fd079"
  },
  "sku": "108930",
  "brand": "Cheswick",
  "count_unit": "Item",
  "department": "Shredded Cheese",
  "dimension_case": "L 1\" x W 1\" x H 1\"",
  "dimension_each": "L 1\" x W 1\" x H 1\"",
  "discount": "",
  "empty": false,
  "href": "https://shop.kimelo.com/sku/cheese-monterey-jack-shredded-fancy-4-5-lb-108930/108930",
  "images": [
    "https://d3tlizm80tjdt4.cloudfront.net/image/7273/image/sm-77f3fe57315491b5b760f3c783c2ce89.jpg",
    "https://d3tlizm80tjdt4.cloudfront.net/image/7274/image/sm-fa023a323e08698aa6db85871aeac420.jpg"
  ],
  "item_counts_case": 4,
  "item_counts_each": 1,
  "name": "Cheese, Monterey Jack, Shredded, Fancy, (4) 5 Lb - 108930",
  "popularity_order": 21,
  "price": 16.26,
  "pricePer": 3.25,
  "price_case": 65.04,
  "price_each": 16.26,
  "price_order": 86,
  "price_unit": "lb",
  "relateds": [
    "103562",
    "103599"
  ],
  "showImage": "https://d3tlizm80tjdt4.cloudfront.net/image/7273/image/sm-77f3fe57315491b5b760f3c783c2ce89.jpg",
  "text": "Cheese, Monterey Jack, Shredded, Fancy (SKU: 108930) is a product from the Cheswick brand, categorized under Shredded Cheese. Each case contains 4 individual items, with each item weighing 1.25 lbs for a total case weight of 5 lbs. The price is $16.26 per item and $65.04 per case, with a price per pound of $3.25. The product’s dimensions for both case and item are L 1\" x W 1\" x H 1\". The cheese is available for purchase and is ranked 86th in price order and 21st in popularity order. Reference images are provided, and the cheese has related products with SKUs 103562 and 103599. For more details or to purchase, visit the product page at https://shop.kimelo.com/sku/cheese-monterey-jack-shredded-fancy-4-5-lb-108930/108930.",
  "weight_case": 5,
  "weight_each": 1.25,
  "weight_unit": "lbs"
},
{
  "_id": {
    "$oid": "681daab1de130bddf45fd07a"
  },
  "sku": "123365",
  "brand": "President",
  "count_unit": "Item",
  "department": "Specialty Cheese",
  "dimension_each": "L 1\" x W 1\" x H 1\"",
  "discount": "",
  "empty": false,
  "href": "https://shop.kimelo.com/sku/cheese-goat-crumbled-22-lb-123365/123365",
  "images": [
    "https://d3tlizm80tjdt4.cloudfront.net/remote_images/image/1031/small/1eadcc43f580efc477560afb62f337d4bfeb222e8f63032220.jpg"
  ],
  "item_counts_each": 1,
  "name": "Cheese, Goat, Crumbled, 2/2 Lb - 123365",
  "popularity_order": 22,
  "price": 33.4,
  "pricePer": 8.35,
  "price_each": 33.4,
  "price_order": 61,
  "price_unit": "lb",
  "relateds": [
    "103638"
  ],
  "showImage": "https://d3tlizm80tjdt4.cloudfront.net/remote_images/image/1031/small/1eadcc43f580efc477560afb62f337d4bfeb222e8f63032220.jpg",
  "text": "The \"Cheese, Goat, Crumbled, 2/2 Lb - 123365\" is a specialty cheese by the brand President, categorized under Specialty Cheese. Each item consists of 4 pounds of crumbled goat cheese, with dimensions of L 1\" x W 1\" x H 1\". The price for each unit is $33.40, which equates to $8.35 per pound. Its Stock Keeping Unit (SKU) is 123365, and it holds price order 61 and popularity order 22 among other cheeses. There are related cheeses, such as SKU 103638, and a preview image is available at https://d3tlizm80tjdt4.cloudfront.net/remote_images/image/1031/small/1eadcc43f580efc477560afb62f337d4bfeb222e8f63032220.jpg. No current discounts apply, and the cheese is in stock. More details can be found at https://shop.kimelo.com/sku/cheese-goat-crumbled-22-lb-123365/123365.",
  "weight_each": 4,
  "weight_unit": "lbs"
},
{
  "_id": {
    "$oid": "681daab1de130bddf45fd07b"
  },
  "sku": "125786",
  "brand": "Packer",
  "count_unit": "Item",
  "department": "Sliced Cheese",
  "dimension_each": "L 1\" x W 1\" x H 1\"",
  "discount": "",
  "empty": false,
  "href": "https://shop.kimelo.com/sku/cheese-monterey-jack-shredded-feather-45-lb-125786/125786",
  "images": [
    "https://d3tlizm80tjdt4.cloudfront.net/remote_images/image/7236/small/e06462a3ca2ee281ec7fdc39e2aecc73c78ebcb6f4d822cc2b.jpg",
    "https://d3tlizm80tjdt4.cloudfront.net/remote_images/image/7241/small/c70ac30661b7378e20f15c03444e4cfbf27c1e5fdec5e5b3cb.jpg"
  ],
  "item_counts_each": 1,
  "name": "Cheese, Monterey Jack, Shredded, Feather, 4/5 Lb 125786",
  "popularity_order": 23,
  "price": 53.01,
  "pricePer": 2.65,
  "price_each": 53.01,
  "price_order": 39,
  "price_unit": "lb",
  "relateds": [],
  "showImage": "https://d3tlizm80tjdt4.cloudfront.net/remote_images/image/7236/small/e06462a3ca2ee281ec7fdc39e2aecc73c78ebcb6f4d822cc2b.jpg",
  "text": "Cheese, Monterey Jack, Shredded, Feather, 4/5 Lb (SKU 125786) is a specialty cheese product from the brand Packer, categorized under Sliced Cheese. Each unit weighs 20 lbs with dimensions of L 1\" x W 1\" x H 1\", and comes as a single item per package. The cheese is priced at $53.01 per item, with a price per pound of $2.65. There is no current discount available, and this product is in stock. You can view two images of the cheese, and it does not have any listed related products. For detailed information or purchase, visit https://shop.kimelo.com/sku/cheese-monterey-jack-shredded-feather-45-lb-125786/125786.",
  "weight_each": 20,
  "weight_unit": "lbs"
},
{
  "_id": {
    "$oid": "681daab2de130bddf45fd07c"
  },
  "sku": "103638",
  "brand": "Laura Chenel",
  "count_unit": "Item",
  "department": "Specialty Cheese",
  "dimension_case": "L 1\" x W 1\" x H 1\"",
  "dimension_each": "L 1\" x W 1\" x H 1\"",
  "discount": "",
  "empty": false,
  "href": "https://shop.kimelo.com/sku/cheese-goat-chefs-chevre-tub-2-4-lb-103638/103638",
  "images": [
    "https://d3tlizm80tjdt4.cloudfront.net/remote_images/image/7584/small/b039cbd43e667de1a64536054485d5b35e81ec59d3181edf0f.jpg"
  ],
  "item_counts_case": 2,
  "item_counts_each": 1,
  "name": "Cheese, Goat, Chefs, Chevre, Tub, (2) 4 Lb - 103638",
  "popularity_order": 25,
  "price": 37.66,
  "pricePer": 9.42,
  "price_case": 75.32,
  "price_each": 37.66,
  "price_order": 56,
  "price_unit": "lb",
  "relateds": [
    "123365"
  ],
  "showImage": "https://d3tlizm80tjdt4.cloudfront.net/remote_images/image/7584/small/b039cbd43e667de1a64536054485d5b35e81ec59d3181edf0f.jpg",
  "text": "Cheese, Goat, Chefs, Chevre, Tub, (2) 4 Lb - 103638 is a specialty cheese from the Laura Chenel brand. It belongs to the Specialty Cheese department and is packaged with each case containing 2 items, each weighing 2 lbs (for a total of 4 lbs per case). The dimensions of each unit and case are L 1\" x W 1\" x H 1\". The price per case is $75.32 and each item individually costs $37.66, with a price per pound of $9.42. This product is in stock, and its SKU is 103638. There is one related cheese with SKU 123365. You can view more details or purchase it at https://shop.kimelo.com/sku/cheese-goat-chefs-chevre-tub-2-4-lb-103638/103638.",
  "weight_case": 4,
  "weight_each": 2,
  "weight_unit": "lbs"
},
{
  "_id": {
    "$oid": "681daab2de130bddf45fd07d"
  },
  "sku": "103602",
  "brand": "California Select Farms",
  "count_unit": "Item",
  "department": "Sliced Cheese",
  "dimension_case": "L 1\" x W 1\" x H 1\"",
  "dimension_each": "L 1\" x W 1\" x H 1\"",
  "discount": "",
  "empty": false,
  "href": "https://shop.kimelo.com/sku/cheese-swiss-sliced-8-15-lb-103602/103602",
  "images": [
    "https://d3tlizm80tjdt4.cloudfront.net/image/8967/image/sm-e52f47ae6c00dd8381ee99b9ffda17dd.jpeg"
  ],
  "item_counts_case": 8,
  "item_counts_each": 1,
  "name": "Cheese, Swiss, Sliced, (8) 1.5 Lb - 103602",
  "popularity_order": 26,
  "price": 8.12,
  "pricePer": 5.41,
  "price_case": 64.96,
  "price_each": 8.12,
  "price_order": 92,
  "price_unit": "lb",
  "relateds": [],
  "showImage": "https://d3tlizm80tjdt4.cloudfront.net/image/8967/image/sm-e52f47ae6c00dd8381ee99b9ffda17dd.jpeg",
  "text": "The \"Cheese, Swiss, Sliced, (8) 1.5 Lb - 103602\" from California Select Farms belongs to the Sliced Cheese department. Each case includes 8 items, with each item weighing 0.1875 lbs, and each case totaling 1.5 lbs. Both the case and each item have dimensions of L 1\" x W 1\" x H 1\". The price is $8.12 per item and $64.96 per case, with a cost of $5.41 per pound. The SKU for this cheese is 103602, and no discount is currently available. The cheese is in stock, and you can view or purchase it at https://shop.kimelo.com/sku/cheese-swiss-sliced-8-15-lb-103602/103602. An image of the product is available at https://d3tlizm80tjdt4.cloudfront.net/image/8967/image/sm-e52f47ae6c00dd8381ee99b9ffda17dd.jpeg. This cheese ranks 92nd by price and 26th by popularity.",
  "weight_case": 1.5,
  "weight_each": 0.1875,
  "weight_unit": "lbs"
},
{
  "_id": {
    "$oid": "681daab2de130bddf45fd07e"
  },
  "sku": "374191",
  "brand": "Pacific Cheese",
  "count_unit": "Item",
  "department": "Sliced Cheese",
  "dimension_case": "L 1\" x W 1\" x H 1\"",
  "dimension_each": "L 1\" x W 1\" x H 1\"",
  "discount": "",
  "empty": false,
  "href": "https://shop.kimelo.com/sku/cheese-swiss-loaf-grade-a-8-lb-avg-6/374191",
  "images": [
    "https://d3tlizm80tjdt4.cloudfront.net/remote_images/image/8356/small/aff0b27efbbacc48d63e4ae9d5ec402d6b6afe2ad94847dca5.jpg"
  ],
  "item_counts_case": 6,
  "item_counts_each": 1,
  "name": "Cheese, Swiss, Loaf, Grade A, 8 Lb Avg (6)",
  "popularity_order": 27,
  "price": 33.6,
  "pricePer": 4.2,
  "price_case": 201.6,
  "price_each": 33.6,
  "price_order": 60,
  "price_unit": "Lb",
  "relateds": [],
  "showImage": "https://d3tlizm80tjdt4.cloudfront.net/remote_images/image/8356/small/aff0b27efbbacc48d63e4ae9d5ec402d6b6afe2ad94847dca5.jpg",
  "text": "Cheese, Swiss, Loaf, Grade A, 8 Lb Avg (6) is a sliced cheese product from the brand Pacific Cheese. It is categorized under Sliced Cheese and comes in both \"EACH\" and \"CASE\" options. Each loaf weighs 8 lbs, and a case includes 6 loaves, totaling 48 lbs per case. The dimensions for both each and case units are L 1\" x W 1\" x H 1\". The price is $33.60 per loaf and $201.60 per case, with a price per pound of $4.20. This cheese has a SKU of 374191, no current discounts, and is available for purchase at https://shop.kimelo.com/sku/cheese-swiss-loaf-grade-a-8-lb-avg-6/374191. There are no related products listed, and its popularity and price order ranks are 27 and 60, respectively. An image of the cheese is available at https://d3tlizm80tjdt4.cloudfront.net/remote_images/image/8356/small/aff0b27efbbacc48d63e4ae9d5ec402d6b6afe2ad94847dca5.jpg.",
  "weight_case": 48,
  "weight_each": 8,
  "weight_unit": "lbs"
},
{
  "_id": {
    "$oid": "681daab3de130bddf45fd07f"
  },
  "sku": "103662",
  "brand": "Packer",
  "count_unit": "Item",
  "department": "Cream Cheese",
  "dimension_each": "L 1\" x W 1\" x H 1\"",
  "discount": "",
  "empty": false,
  "href": "https://shop.kimelo.com/sku/cheese-cream-bulk-30-lb-103662/103662",
  "images": [
    "https://d3tlizm80tjdt4.cloudfront.net/remote_images/image/7674/small/d6f2f5e1dcdf0874f7bfedc969aead3f8aa0af8033196b2d75.jpg",
    "https://d3tlizm80tjdt4.cloudfront.net/image/6409/image/sm-f7a04a05168dc605a36e0baca9fc3090.jpg"
  ],
  "item_counts_each": 1,
  "name": "Cheese, Cream, Bulk, 30 Lb - 103662",
  "popularity_order": 28,
  "price": 70.05,
  "pricePer": 2.34,
  "price_each": 70.05,
  "price_order": 32,
  "price_unit": "lb",
  "relateds": [
    "103663",
    "112699"
  ],
  "showImage": "https://d3tlizm80tjdt4.cloudfront.net/remote_images/image/7674/small/d6f2f5e1dcdf0874f7bfedc969aead3f8aa0af8033196b2d75.jpg",
  "text": "Cheese, Cream, Bulk, 30 Lb - 103662, is a cream cheese product from the brand Packer, categorized under Cream Cheese. Each unit contains 1 item with dimensions of L 1\" x W 1\" x H 1\" and weighs 30.98 lbs. The price for each unit is $70.05, with a price per pound of $2.34/lb. This cheese has related products with SKUs 103663 and 112699. There are two reference images available for this product. Its SKU is 103662, and it currently has no discounts and is in stock. For more details, visit https://shop.kimelo.com/sku/cheese-cream-bulk-30-lb-103662/103662. This product is ranked 32nd in price and 28th in popularity.",
  "weight_each": 30.98,
  "weight_unit": "lbs"
},
{
  "_id": {
    "$oid": "681daab3de130bddf45fd080"
  },
  "sku": "124005",
  "brand": "Gopi",
  "count_unit": "Item",
  "department": "Sliced Cheese",
  "dimension_each": "L 1\" x W 1\" x H 1\"",
  "discount": "",
  "empty": false,
  "href": "https://shop.kimelo.com/sku/cheese-paneer-gopi-1514-oz-124005/124005",
  "images": [
    "https://d3tlizm80tjdt4.cloudfront.net/remote_images/image/1912/small/f31c646bfa3f07281c27762b126aee2f792632f3d44342335b.jpg"
  ],
  "item_counts_each": 1,
  "name": "Cheese, Paneer, Gopi, 15/14 Oz 124005",
  "popularity_order": 29,
  "price": 94,
  "pricePer": 7.23,
  "price_each": 94,
  "price_order": 23,
  "price_unit": "lb",
  "relateds": [],
  "showImage": "https://d3tlizm80tjdt4.cloudfront.net/remote_images/image/1912/small/f31c646bfa3f07281c27762b126aee2f792632f3d44342335b.jpg",
  "text": "Cheese, Paneer, Gopi, 15/14 Oz 124005 is a sliced cheese product from the brand Gopi, categorized under Sliced Cheese. Each unit consists of 1 item with dimensions of L 1\" x W 1\" x H 1\" and a weight of 13.12 lbs. The cheese is priced at $94.00 per unit, with a price per pound of $7.23/lb, and currently offers no discounts. The SKU for this item is 124005 and it is available for purchase; it is not marked as empty. There are no related cheese products listed for this item. The item ranks 23rd in terms of price (highest first) and 29th in popularity. You can view the product and its image at the provided link: https://shop.kimelo.com/sku/cheese-paneer-gopi-1514-oz-124005/124005.",
  "weight_each": 13.12,
  "weight_unit": "lbs"
},
{
  "_id": {
    "$oid": "681daab3de130bddf45fd081"
  },
  "sku": "125787",
  "brand": "Packer",
  "count_unit": "Item",
  "department": "Shredded Cheese",
  "dimension_each": "L 1\" x W 1\" x H 1\"",
  "discount": "",
  "empty": false,
  "href": "https://shop.kimelo.com/sku/cheese-shredded-jack-cheddar-blend-feather-45-lb-125787/125787",
  "images": [
    "https://d3tlizm80tjdt4.cloudfront.net/remote_images/image/7242/small/45efa6a9c307f7f9d844c75f7ef87eab93a985461d20a81030.jpg"
  ],
  "item_counts_each": 1,
  "name": "Cheese, Shredded, Jack & Cheddar Blend, Feather, 4/5 Lb 125787",
  "popularity_order": 30,
  "price": 55.56,
  "pricePer": 2.78,
  "price_each": 55.56,
  "price_order": 37,
  "price_unit": "lb",
  "relateds": [],
  "showImage": "https://d3tlizm80tjdt4.cloudfront.net/remote_images/image/7242/small/45efa6a9c307f7f9d844c75f7ef87eab93a985461d20a81030.jpg",
  "text": "This cheese is the \"Cheese, Shredded, Jack & Cheddar Blend, Feather, 4/5 Lb 125787\" from the brand Packer, categorized under Shredded Cheese. It comes as a single item per unit, with each unit weighing 20 lbs and having dimensions of L 1\" x W 1\" x H 1\". The price for each unit is $55.56, which corresponds to $2.78 per pound. The product SKU is 125787 and it is currently available in stock. An image preview can be viewed at https://d3tlizm80tjdt4.cloudfront.net/remote_images/image/7242/small/45efa6a9c307f7f9d844c75f7ef87eab93a985461d20a81030.jpg. There are no related cheeses listed or active discounts for this product. More details are available at https://shop.kimelo.com/sku/cheese-shredded-jack-cheddar-blend-feather-45-lb-125787/125787, where it ranks 37th by price and 30th by popularity.",
  "weight_each": 20,
  "weight_unit": "lbs"
},
{
  "_id": {
    "$oid": "681daab4de130bddf45fd082"
  },
  "sku": "111680",
  "brand": "Hoffman`s",
  "count_unit": "Item",
  "department": "Sliced Cheese",
  "dimension_each": "L 1\" x W 1\" x H 1\"",
  "discount": "",
  "empty": false,
  "href": "https://shop.kimelo.com/sku/cheese-cheddar-sharp-white-10-lb-111680/111680",
  "images": [
    "https://d3tlizm80tjdt4.cloudfront.net/image/16001/image/sm-d62189f66ce8c51c9bbbd406104ca89e.png",
    "https://d3tlizm80tjdt4.cloudfront.net/image/16002/image/sm-017dee8e2ba7d0a6a8ee1db2af46dec4.png"
  ],
  "item_counts_each": 1,
  "name": "Cheese, Cheddar, Sharp, White, 10 Lb - 111680",
  "popularity_order": 34,
  "price": 41.88,
  "pricePer": 4.19,
  "price_each": 41.88,
  "price_order": 52,
  "price_unit": "lb",
  "relateds": [
    "103600",
    "106815"
  ],
  "showImage": "https://d3tlizm80tjdt4.cloudfront.net/image/16001/image/sm-d62189f66ce8c51c9bbbd406104ca89e.png",
  "text": "Cheese, Cheddar, Sharp, White, 10 Lb - 111680 is a sharp white cheddar cheese from Hoffman’s, classified under the Sliced Cheese department. Each unit consists of 1 item with dimensions L 1\" x W 1\" x H 1\" and a weight of 10 lbs. The price for each is $41.88, making it $4.19 per pound. The SKU for this cheese is 111680, and it has related products with SKUs 103600 and 106815. Reference images are available at two provided URLs. This cheese currently has no discounts and is in stock. For more details or purchase, visit the provided link.",
  "weight_each": 10,
  "weight_unit": "lbs"
},
{
  "_id": {
    "$oid": "681daab4de130bddf45fd083"
  },
  "sku": "103672",
  "brand": "Cheswick",
  "count_unit": "Item",
  "department": "Cheese Loaf",
  "dimension_case": "L 1\" x W 1\" x H 1\"",
  "dimension_each": "L 1\" x W 1\" x H 1\"",
  "discount": "",
  "empty": false,
  "href": "https://shop.kimelo.com/sku/cheese-pepper-jack-loaf-8-103672/103672",
  "images": [
    "https://d3tlizm80tjdt4.cloudfront.net/image/15256/image/sm-6c299387672a8119d43997e98fcbcfc1.png",
    "https://d3tlizm80tjdt4.cloudfront.net/image/2240/image/sm-0e28dfb31e470fa64b2a2a3725ca747b.png"
  ],
  "item_counts_case": 8,
  "item_counts_each": 1,
  "name": "Cheese, Pepper Jack, Loaf (8) 103672",
  "popularity_order": 35,
  "price": 17.47,
  "pricePer": 3.49,
  "price_case": 139.76,
  "price_each": 17.47,
  "price_order": 79,
  "price_unit": "lb",
  "relateds": [
    "108930",
    "123794",
    "107600",
    "108930",
    "123794",
    "107600",
    "108930",
    "123794"
  ],
  "showImage": "https://d3tlizm80tjdt4.cloudfront.net/image/15256/image/sm-6c299387672a8119d43997e98fcbcfc1.png",
  "text": "Cheese, Pepper Jack, Loaf (8) 103672 is a specialty cheese loaf from the brand Cheswick, categorized under Cheese Loaf. Each case contains 8 individual loaves, with each loaf weighing 0.625 lbs and the total case weight being 5 lbs. The product dimensions for both single and case units are L 1\" x W 1\" x H 1\". The price for each loaf is $17.47, while a case costs $139.76, with a price per pound of $3.49. The cheese is referenced by SKU 103672, and a preview image is available at https://d3tlizm80tjdt4.cloudfront.net/image/15256/image/sm-6c299387672a8119d43997e98fcbcfc1.png. Related cheeses include SKUs 108930, 123794, and 107600. There are currently no discounts available, and the product is in stock. More details can be found at https://shop.kimelo.com/sku/cheese-pepper-jack-loaf-8-103672/103672, with a price order of 79 and a popularity ranking of 35.",
  "weight_case": 5,
  "weight_each": 0.625,
  "weight_unit": "lbs"
},
{
  "_id": {
    "$oid": "681daab5de130bddf45fd084"
  },
  "sku": "106845",
  "brand": "Atalanta",
  "count_unit": "Item",
  "department": "Specialty Cheese",
  "dimension_each": "L 1\" x W 1\" x H 1\"",
  "discount": "",
  "empty": false,
  "href": "https://shop.kimelo.com/sku/cheese-feta-bulgarian-in-brine-17-kg-106845/106845",
  "images": [
    "https://d3tlizm80tjdt4.cloudfront.net/image/6242/image/sm-9063431364cbcf7278cdde3f4d5f47fb.jpg",
    "https://d3tlizm80tjdt4.cloudfront.net/image/6243/image/sm-28f21308ae2ddaddc061a75af68a7d90.jpg"
  ],
  "item_counts_each": 1,
  "name": "Cheese, Feta, Bulgarian, In Brine, 1/7 Kg - 106845",
  "popularity_order": 36,
  "price": 72,
  "pricePer": 4.8,
  "price_each": 72,
  "price_order": 30,
  "price_unit": "lb",
  "relateds": [
    "123797"
  ],
  "showImage": "https://d3tlizm80tjdt4.cloudfront.net/image/6242/image/sm-9063431364cbcf7278cdde3f4d5f47fb.jpg",
  "text": "Cheese, Feta, Bulgarian, In Brine, 1/7 Kg - 106845 is a specialty cheese offered by the brand Atalanta. This feta cheese comes in brine and is part of the Specialty Cheese department. Each unit contains 1 item with dimensions of L 1\" x W 1\" x H 1\" and weighs 15.43 lbs. The price per item is $72.00, with a price per pound of $4.80/lb. It is available under the SKU 106845, and there is a related product with SKU 123797. There are multiple images available for reference, and the cheese is currently not out of stock. You can view more details or make a purchase at https://shop.kimelo.com/sku/cheese-feta-bulgarian-in-brine-17-kg-106845/106845. The product holds a price order ranking of 30 and a popularity order ranking of 36.",
  "weight_each": 15.43,
  "weight_unit": "lbs"
},
{
  "_id": {
    "$oid": "681daab5de130bddf45fd085"
  },
  "sku": "123382",
  "brand": "Galbani",
  "count_unit": "Item",
  "department": "Specialty Cheese",
  "dimension_each": "L 1\" x W 1\" x H 1\"",
  "discount": "",
  "empty": false,
  "href": "https://shop.kimelo.com/sku/cheese-mozzarella-fresh-ovoline-galbani-23-lb-123382/123382",
  "images": [
    "https://d3tlizm80tjdt4.cloudfront.net/remote_images/image/1050/small/4d39f5a7140280525c6242eaa3c6a455f2fea2640ccdf683fe.jpg"
  ],
  "item_counts_each": 1,
  "name": "Cheese, Mozzarella, Fresh, Ovoline, Galbani, 2/3 Lb - 123382",
  "popularity_order": 37,
  "price": 34.67,
  "pricePer": 5.78,
  "price_each": 34.67,
  "price_order": 57,
  "price_unit": "lb",
  "relateds": [],
  "showImage": "https://d3tlizm80tjdt4.cloudfront.net/remote_images/image/1050/small/4d39f5a7140280525c6242eaa3c6a455f2fea2640ccdf683fe.jpg",
  "text": "Cheese, Mozzarella, Fresh, Ovoline, Galbani, 2/3 Lb (SKU: 123382) is a specialty cheese from the Galbani brand. It is categorized under Specialty Cheese and is sold as a single item, each weighing 6 lbs with dimensions L 1\" x W 1\" x H 1\". The cheese is offered at a price of $34.67 per item, which equates to $5.78 per pound. There are no current discounts available for this product, and it is currently in stock. You can view the product at [this link](https://shop.kimelo.com/sku/cheese-mozzarella-fresh-ovoline-galbani-23-lb-123382/123382), and a preview image is available through the provided URL. There are no related SKU items listed, and its price and popularity order are 57 and 37, respectively.",
  "weight_each": 6,
  "weight_unit": "lbs"
},
{
  "_id": {
    "$oid": "681daab5de130bddf45fd086"
  },
  "sku": "124189",
  "brand": "Galbani",
  "count_unit": "Item",
  "department": "Specialty Cheese",
  "dimension_each": "L 1\" x W 1\" x H 1\"",
  "discount": "",
  "empty": false,
  "href": "https://shop.kimelo.com/sku/cheese-mozzarella-wmlm-shredded-red-label-65-lb-124189/124189",
  "images": [
    "https://d3tlizm80tjdt4.cloudfront.net/remote_images/image/2018/small/e6aa96eb9c4f11476e530c078ea7e9331b62c1f1b0bd80fbcd.jpg"
  ],
  "item_counts_each": 1,
  "name": "Cheese, Mozzarella, Wmlm, Shredded, Red Label, 6/5 Lb 124189",
  "popularity_order": 38,
  "price": 95.83,
  "pricePer": 3.19,
  "price_each": 95.83,
  "price_order": 22,
  "price_unit": "lb",
  "relateds": [
    "123382"
  ],
  "showImage": "https://d3tlizm80tjdt4.cloudfront.net/remote_images/image/2018/small/e6aa96eb9c4f11476e530c078ea7e9331b62c1f1b0bd80fbcd.jpg",
  "text": "Cheese, Mozzarella, Wmlm, Shredded, Red Label, 6/5 Lb (SKU: 124189) is a specialty cheese product from the brand Galbani. This cheese is categorized under Specialty Cheese and comes in a packaging size where each unit contains 1 item with a total weight of 30 lbs. The dimensions for each unit are L 1\" x W 1\" x H 1\". The price per unit is $95.83, which averages to $3.19 per pound. There are related cheese products such as SKU 123382. The cheese is currently available and can be viewed or purchased at https://shop.kimelo.com/sku/cheese-mozzarella-wmlm-shredded-red-label-65-lb-124189/124189. No discounts are currently offered on this product. The popularity rank for this cheese is 38, and it holds a price rank of 22 in its category.",
  "weight_each": 30,
  "weight_unit": "lbs"
},
{
  "_id": {
    "$oid": "681daab6de130bddf45fd087"
  },
  "sku": "125724",
  "brand": "California Gold",
  "count_unit": "Item",
  "department": "Cheese Loaf",
  "dimension_each": "L 1\" x W 1\" x H 1\"",
  "discount": "",
  "empty": false,
  "href": "https://shop.kimelo.com/sku/cheese-mozzarella-lmwm-cali-gold-loaf-86-lb-125724/125724",
  "images": [
    "https://d3tlizm80tjdt4.cloudfront.net/remote_images/image/7214/small/e9ab65ec35fd13418c56e43a697f0cd6f2464279cf92c5e10b.jpg"
  ],
  "item_counts_each": 1,
  "name": "Cheese, Mozzarella, Lmwm, Cali Gold, Loaf, 8/6 Lb 125724",
  "popularity_order": 40,
  "price": 104.08,
  "pricePer": 2.17,
  "price_each": 104.08,
  "price_order": 16,
  "price_unit": "lb",
  "relateds": [],
  "showImage": "https://d3tlizm80tjdt4.cloudfront.net/remote_images/image/7214/small/e9ab65ec35fd13418c56e43a697f0cd6f2464279cf92c5e10b.jpg",
  "text": "Cheese, Mozzarella, Lmwm, Cali Gold, Loaf, 8/6 Lb (SKU: 125724) is a specialty cheese loaf produced by the brand California Gold. This cheese belongs to the \"Cheese Loaf\" department and is sold in units where each item weighs 48 lbs, with dimensions of L 1\" x W 1\" x H 1\". The price for each loaf is $104.08, which comes to $2.17 per pound. There are currently no related cheeses listed for this SKU, and no discounts are offered. The cheese is in stock and available for purchase online at https://shop.kimelo.com/sku/cheese-mozzarella-lmwm-cali-gold-loaf-86-lb-125724/125724. Its price order ranking is 16th highest, while its popularity ranking is 40. A preview image can be found at https://d3tlizm80tjdt4.cloudfront.net/remote_images/image/7214/small/e9ab65ec35fd13418c56e43a697f0cd6f2464279cf92c5e10b.jpg.",
  "weight_each": 48,
  "weight_unit": "lbs"
},
{
  "_id": {
    "$oid": "681daab6de130bddf45fd088"
  },
  "sku": "41530",
  "brand": "Kraft",
  "count_unit": "Item",
  "department": "Cream Cheese",
  "dimension_each": "L 1\" x W 1\" x H 1\"",
  "discount": "",
  "empty": false,
  "href": "https://shop.kimelo.com/sku/cheese-cream-cheese-philadelphia-portions-cups-111589/41530",
  "images": [
    "https://d3tlizm80tjdt4.cloudfront.net/remote_images/image/9657/small/5ab654f51d8f2e0ef8a931a3ab768ea564c152a1904483a59b.jpg"
  ],
  "item_counts_each": 1,
  "name": "Cheese, Cream Cheese, Philadelphia, Portions, Cups - 111589",
  "popularity_order": 41,
  "price": 51.49,
  "pricePer": 0.51,
  "price_each": 51.49,
  "price_order": 40,
  "price_unit": "ct",
  "relateds": [],
  "showImage": "https://d3tlizm80tjdt4.cloudfront.net/remote_images/image/9657/small/5ab654f51d8f2e0ef8a931a3ab768ea564c152a1904483a59b.jpg",
  "text": "Cheese, Cream Cheese, Philadelphia, Portions, Cups - 111589 is a cream cheese product from the brand Kraft. It is categorized under the Cream Cheese department. Each unit consists of 1 item, with dimensions of L 1\" x W 1\" x H 1\" and a weight of 6.25 lbs. The price for each unit is $51.49, and the price per count is $0.51/ct. The SKU for this product is 41530, and there is currently no discount offered. There are no related cheese products listed, and it is available for purchase at https://shop.kimelo.com/sku/cheese-cream-cheese-philadelphia-portions-cups-111589/41530. This cheese has a price order of 40 and a popularity order of 41.",
  "weight_each": 6.25,
  "weight_unit": "lbs"
},
{
  "_id": {
    "$oid": "681daab6de130bddf45fd089"
  },
  "sku": "124111",
  "brand": "Ziria",
  "count_unit": "Item",
  "department": "Specialty Cheese",
  "dimension_each": "L 1\" x W 1\" x H 1\"",
  "discount": "",
  "empty": false,
  "href": "https://shop.kimelo.com/sku/cheese-feta-sheepgoat-imported-ziria-14-kg-124111/124111",
  "images": [
    "https://d3tlizm80tjdt4.cloudfront.net/remote_images/image/2224/small/7cb4d700b40ef33831a2d0c139d2be7237896927905a07bab6.jpg"
  ],
  "item_counts_each": 1,
  "name": "Cheese, Feta, Sheep/goat, Imported, Ziria, 14 Kg 124111",
  "popularity_order": 42,
  "price": 166.17,
  "pricePer": 5.36,
  "price_each": 166.17,
  "price_order": 2,
  "price_unit": "lb",
  "relateds": [
    "123797",
    "124006"
  ],
  "showImage": "https://d3tlizm80tjdt4.cloudfront.net/remote_images/image/2224/small/7cb4d700b40ef33831a2d0c139d2be7237896927905a07bab6.jpg",
  "text": "Cheese, Feta, Sheep/goat, Imported, Ziria, 14 Kg (SKU: 124111) is a specialty cheese from the brand Ziria. It comes in a single unit with each item weighing 31 lbs, and the dimensions for each are L 1\" x W 1\" x H 1\". The price for each item is $166.17, which equals $5.36 per pound. This cheese is currently available in-store with no discounts offered. Related cheeses include SKUs 123797 and 124006. It is ranked 2nd in price and 42nd in popularity among similar products. For more details or to purchase, visit the product page at https://shop.kimelo.com/sku/cheese-feta-sheepgoat-imported-ziria-14-kg-124111/124111. Preview and reference images are available at https://d3tlizm80tjdt4.cloudfront.net/remote_images/image/2224/small/7cb4d700b40ef33831a2d0c139d2be7237896927905a07bab6.jpg.",
  "weight_each": 31,
  "weight_unit": "lbs"
},
{
  "_id": {
    "$oid": "681daab7de130bddf45fd08a"
  },
  "sku": "125636",
  "brand": "Schreiber",
  "count_unit": "Item",
  "department": "Sliced Cheese",
  "dimension_each": "L 1\" x W 1\" x H 1\"",
  "discount": "",
  "empty": false,
  "href": "https://shop.kimelo.com/sku/cheese-processed-american-yellow-slices-160-ct-45-lb-125636/125636",
  "images": [
    "https://d3tlizm80tjdt4.cloudfront.net/remote_images/image/5355/small/813a16121b3359e9889266333999b54523e3768c6a5fb0829b.jpg"
  ],
  "item_counts_each": 1,
  "name": "Cheese, Processed, American, Yellow, Slices, 160 Ct, 4/5 Lb 125636",
  "popularity_order": 43,
  "price": 72.32,
  "pricePer": 0,
  "price_each": 72.32,
  "price_order": 29,
  "price_unit": "lb",
  "relateds": [],
  "showImage": "https://d3tlizm80tjdt4.cloudfront.net/remote_images/image/5355/small/813a16121b3359e9889266333999b54523e3768c6a5fb0829b.jpg",
  "text": "This cheese is called \"Cheese, Processed, American, Yellow, Slices, 160 Ct, 4/5 Lb 125636\" and is produced by the brand Schreiber. It belongs to the Sliced Cheese department. Each unit consists of one item, with the dimensions of L 1\" x W 1\" x H 1\" and a total weight of 20 lbs. The price for each item is $72.32, with a price per weight listed as $0 per pound. The SKU for this cheese is 125636, and there are currently no discounts or related cheese products listed. The cheese is available for purchase and more details can be found at https://shop.kimelo.com/sku/cheese-processed-american-yellow-slices-160-ct-45-lb-125636/125636. This product is ranked 29th in terms of price and 43rd in popularity among cheeses offered by the shop.",
  "weight_each": 20,
  "weight_unit": "lbs"
},
{
  "_id": {
    "$oid": "681daab7de130bddf45fd08b"
  },
  "sku": "100014",
  "brand": "Commodity Cheese",
  "count_unit": "Item",
  "department": "Sliced Cheese",
  "dimension_case": "L 1\" x W 1\" x H 1\"",
  "dimension_each": "L 1\" x W 1\" x H 1\"",
  "discount": "",
  "empty": false,
  "href": "https://shop.kimelo.com/sku/cheese-swiss-sliced-processed-120-ct-4-5-lb-100014/100014",
  "images": [
    "https://d3tlizm80tjdt4.cloudfront.net/image/1475/image/sm-d9e58637d835b0d794288cd8d983fbd2.jpg",
    "https://d3tlizm80tjdt4.cloudfront.net/image/1474/image/sm-f655d358744b5afb25fbb0300dcbd7e9.jpg"
  ],
  "item_counts_case": 4,
  "item_counts_each": 1,
  "name": "Cheese, Swiss, Sliced, Processed, 120 Ct, (4) 5 Lb - 100014",
  "popularity_order": 44,
  "price": 19.47,
  "pricePer": 3.89,
  "price_case": 77.88,
  "price_each": 19.47,
  "price_order": 76,
  "price_unit": "lb",
  "relateds": [
    "103674"
  ],
  "showImage": "https://d3tlizm80tjdt4.cloudfront.net/image/1474/image/sm-f655d358744b5afb25fbb0300dcbd7e9.jpg",
  "text": "Cheese, Swiss, Sliced, Processed, 120 Ct, (4) 5 Lb - 100014 is a processed Swiss cheese offered by Commodity Cheese in the Sliced Cheese department. Each case contains 4 individual items, with every item weighing 1.285 lbs and each case weighing 5.14 lbs; the dimensions for each and each case are both L 1\" x W 1\" x H 1\". The price for each item is $19.47, and a full case costs $77.88, with a price per pound of $3.89. The cheese is available for purchase and is not out of stock. The product’s SKU is 100014 and it is ranked 76th by price and 44th in popularity. Reference images are provided, and related SKU 103674 is also listed. More information and purchase options can be found at https://shop.kimelo.com/sku/cheese-swiss-sliced-processed-120-ct-4-5-lb-100014/100014.",
  "weight_case": 5.14,
  "weight_each": 1.285,
  "weight_unit": "lbs"
},
{
  "_id": {
    "$oid": "681daab8de130bddf45fd08c"
  },
  "sku": "125986",
  "brand": "California Gold",
  "count_unit": "Item",
  "department": "Specialty Cheese",
  "dimension_each": "L 1\" x W 1\" x H 1\"",
  "discount": "",
  "empty": false,
  "href": "https://shop.kimelo.com/sku/cheese-mozzarella-pslm-cali-gold-loaf-86-lb-125986/125986",
  "images": [
    "https://d3tlizm80tjdt4.cloudfront.net/remote_images/image/7730/small/66c3c8d496d6f67e6986f5b051fc2aa6406223c1602f88978c.jpg",
    "https://d3tlizm80tjdt4.cloudfront.net/remote_images/image/7735/small/928aeeb52bdd5d95ec0ef23f9fdf39266d58214a9625db3a1b.jpg"
  ],
  "item_counts_each": 1,
  "name": "Cheese, Mozzarella, Pslm, Cali Gold, Loaf, 8/6 Lb 125986",
  "popularity_order": 45,
  "price": 100.16,
  "pricePer": 2.09,
  "price_each": 100.16,
  "price_order": 19,
  "price_unit": "lb",
  "relateds": [],
  "showImage": "https://d3tlizm80tjdt4.cloudfront.net/remote_images/image/7730/small/66c3c8d496d6f67e6986f5b051fc2aa6406223c1602f88978c.jpg",
  "text": "Cheese, Mozzarella, Pslm, Cali Gold, Loaf, 8/6 Lb (SKU: 125986) is a specialty cheese from the California Gold brand. This product belongs to the Specialty Cheese department. Each unit consists of one loaf weighing 48 lbs, with dimensions of L 1\" x W 1\" x H 1\". The price for each loaf is $100.16, which is equivalent to $2.09 per pound. Reference images can be found at the provided URLs. There are currently no related products or discounts available for this cheese. The product is available for purchase and ranks 19th in price and 45th in popularity. For more details or to buy, visit the product link.",
  "weight_each": 48,
  "weight_unit": "lbs"
},
{
  "_id": {
    "$oid": "681daab8de130bddf45fd08d"
  },
  "sku": "112306",
  "brand": "Galbani",
  "count_unit": "Item",
  "department": "Cheese Wheel",
  "dimension_each": "L 1\" x W 1\" x H 1\"",
  "discount": "",
  "empty": false,
  "href": "https://shop.kimelo.com/sku/cheese-parmesan-wheel-usa-20-lb-avg-112306/112306",
  "images": [
    "https://d3tlizm80tjdt4.cloudfront.net/image/12274/image/sm-64a4aa1bc8ce6d4a0e316c4b84cca0b9.png"
  ],
  "item_counts_each": 1,
  "name": "Cheese, Parmesan, Wheel, Usa, 20 Lb Avg - 112306",
  "popularity_order": 46,
  "price": 111.67,
  "pricePer": 5.58,
  "price_each": 111.67,
  "price_order": 10,
  "price_unit": "lb",
  "relateds": [
    "106816",
    "111522"
  ],
  "showImage": "https://d3tlizm80tjdt4.cloudfront.net/image/12274/image/sm-64a4aa1bc8ce6d4a0e316c4b84cca0b9.png",
  "text": "Galbani Cheese, Parmesan, Wheel, USA, 20 Lb Avg (SKU: 112306) is a specialty cheese wheel offered by the Galbani brand in the Cheese Wheel department. Each item is a whole parmesan wheel with approximate dimensions of L 1\" x W 1\" x H 1\" and a weight of 20 lbs. The price for each wheel is $111.67, translating to $5.58 per pound. This cheese has a price order ranking of 10 and a popularity order ranking of 46. You can view and purchase this product at https://shop.kimelo.com/sku/cheese-parmesan-wheel-usa-20-lb-avg-112306/112306. There are related products with SKUs 106816 and 111522. The product image is available at https://d3tlizm80tjdt4.cloudfront.net/image/12274/image/sm-64a4aa1bc8ce6d4a0e316c4b84cca0b9.png, and the item is currently in stock with no discounts offered.",
  "weight_each": 20,
  "weight_unit": "lbs"
},
{
  "_id": {
    "$oid": "681daab8de130bddf45fd08e"
  },
  "sku": "124284",
  "brand": "Cucina",
  "count_unit": "Item",
  "department": "Specialty Cheese",
  "dimension_case": "L 1\" x W 1\" x H 1\"",
  "dimension_each": "L 1\" x W 1\" x H 1\"",
  "discount": "",
  "empty": false,
  "href": "https://shop.kimelo.com/sku/cheese-feta-in-brine-pail-2-8-lb-124284/124284",
  "images": [
    "https://d3tlizm80tjdt4.cloudfront.net/remote_images/image/7673/small/0b979f0fa945c83473934cf317ee8339e16a68ae1af19108f3.jpg"
  ],
  "item_counts_case": 2,
  "item_counts_each": 1,
  "name": "Cheese, Feta, In Brine, Pail, (2) 8 Lb 124284",
  "popularity_order": 47,
  "price": 29.44,
  "pricePer": 3.68,
  "price_case": 58.88,
  "price_each": 29.44,
  "price_order": 66,
  "price_unit": "lb",
  "relateds": [
    "123797"
  ],
  "showImage": "https://d3tlizm80tjdt4.cloudfront.net/remote_images/image/7673/small/0b979f0fa945c83473934cf317ee8339e16a68ae1af19108f3.jpg",
  "text": "Cheese, Feta, In Brine, Pail, (2) 8 Lb 124284 from the Cucina brand is categorized as Specialty Cheese. Each unit contains 1 item weighing 4 lbs, and a case consists of 2 items, each measuring L 1\" x W 1\" x H 1\", with the case totaling 8 lbs. The cheese is presented in a pail and sold at $29.44 per item or $58.88 per case, with a price per pound of $3.68/lb. The SKU is 124284 and a related SKU is 123797. There are no current discounts, and the item is available for purchase. The cheese’s image can be viewed at the provided URL, and more details are available at https://shop.kimelo.com/sku/cheese-feta-in-brine-pail-2-8-lb-124284/124284. Its price order is 66 and its popularity order is 47 among cheeses.",
  "weight_case": 8,
  "weight_each": 4,
  "weight_unit": "lbs"
},
{
  "_id": {
    "$oid": "681daab9de130bddf45fd08f"
  },
  "sku": "112699",
  "brand": "Raskas",
  "count_unit": "Item",
  "department": "Cheese Loaf",
  "dimension_each": "L 1\" x W 1\" x H 1\"",
  "discount": "",
  "empty": false,
  "href": "https://shop.kimelo.com/sku/cheese-cream-loaf-103-lb-112699/112699",
  "images": [
    "https://d3tlizm80tjdt4.cloudfront.net/image/13945/image/sm-beec542c40fb4977939baab11abd9a9c.png",
    "https://d3tlizm80tjdt4.cloudfront.net/image/13946/image/sm-732bba78fb4923d20761d47925268dcd.png"
  ],
  "item_counts_each": 1,
  "name": "Cheese, Cream, Loaf, 10/3 Lb - 112699",
  "popularity_order": 48,
  "price": 85.56,
  "pricePer": 2.85,
  "price_each": 85.56,
  "price_order": 25,
  "price_unit": "lb",
  "relateds": [
    "103662",
    "103663"
  ],
  "showImage": "https://d3tlizm80tjdt4.cloudfront.net/image/13945/image/sm-beec542c40fb4977939baab11abd9a9c.png",
  "text": "Cheese, Cream, Loaf, 10/3 Lb - 112699 is a cream cheese loaf offered by the brand Raskas in the Cheese Loaf department. Each unit contains 1 item with dimensions of L 1\" x W 1\" x H 1\" and a total weight of 30 lbs. The cheese is priced at $85.56 per item, equivalent to $2.85 per pound. The SKU for this product is 112699, and it is currently available for purchase. Reference images for this product include https://d3tlizm80tjdt4.cloudfront.net/image/13945/image/sm-beec542c40fb4977939baab11abd9a9c.png and https://d3tlizm80tjdt4.cloudfront.net/image/13946/image/sm-732bba78fb4923d20761d47925268dcd.png. Related products are identified by SKUs 103662 and 103663. For more details or to order, visit https://shop.kimelo.com/sku/cheese-cream-loaf-103-lb-112699/112699.",
  "weight_each": 30,
  "weight_unit": "lbs"
},
{
  "_id": {
    "$oid": "681daab9de130bddf45fd090"
  },
  "sku": "124125",
  "brand": "Metsobo A.e.",
  "count_unit": "Item",
  "department": "Sliced Cheese",
  "dimension_each": "L 1\" x W 1\" x H 1\"",
  "discount": "",
  "empty": false,
  "href": "https://shop.kimelo.com/sku/cheese-kefalotyri-hard-wheel-greek-import-18-lb-avg-124125/124125",
  "images": [
    "https://d3tlizm80tjdt4.cloudfront.net/remote_images/image/2228/small/f9ce4763fea7376f93257d4fc25b186ab2c423231574348ceb.jpg"
  ],
  "item_counts_each": 1,
  "name": "Cheese, Kefalotyri, Hard, Wheel, Greek, Import, 18 Lb Avg 124125",
  "popularity_order": 50,
  "price": 156.06,
  "pricePer": 8.67,
  "price_each": 156.06,
  "price_order": 4,
  "price_unit": "lb",
  "relateds": [],
  "showImage": "https://d3tlizm80tjdt4.cloudfront.net/remote_images/image/2228/small/f9ce4763fea7376f93257d4fc25b186ab2c423231574348ceb.jpg",
  "text": "Cheese, Kefalotyri, Hard, Wheel, Greek, Import, 18 Lb Avg 124125 is a specialty cheese produced by Metsobo A.e. and categorized under Sliced Cheese. Each unit consists of one wheel with dimensions of L 1\" x W 1\" x H 1\" and a weight of 18 lbs on average. The price for each wheel is $156.06, which corresponds to $8.67 per pound. This imported Greek Kefalotyri cheese is available for purchase, with its SKU being 124125, and currently, there is no discount offered. No related cheeses are listed, and it ranks fourth in price order and 50th in popularity. For more information or to purchase, visit https://shop.kimelo.com/sku/cheese-kefalotyri-hard-wheel-greek-import-18-lb-avg-124125/124125. An image of the cheese can be found at https://d3tlizm80tjdt4.cloudfront.net/remote_images/image/2228/small/f9ce4763fea7376f93257d4fc25b186ab2c423231574348ceb.jpg.",
  "weight_each": 18,
  "weight_unit": "lbs"
},
{
  "_id": {
    "$oid": "681daabade130bddf45fd091"
  },
  "sku": "124144",
  "brand": "Alambra",
  "count_unit": "Item",
  "department": "Sliced Cheese",
  "dimension_each": "L 1\" x W 1\" x H 1\"",
  "discount": "",
  "empty": false,
  "href": "https://shop.kimelo.com/sku/cheese-halloumi-tradition-greek-import-4088-oz-124144/124144",
  "images": [
    "https://d3tlizm80tjdt4.cloudfront.net/remote_images/image/1998/small/92cb453b056d15b02a89fefb67e39797fc58b0a4398a29b53f.jpg"
  ],
  "item_counts_each": 1,
  "name": "Cheese, Halloumi, Tradition, Greek, Import, 40/8.8 Oz 124144",
  "popularity_order": 51,
  "price": 197.35,
  "pricePer": 8.97,
  "price_each": 197.35,
  "price_order": 1,
  "price_unit": "lb",
  "relateds": [],
  "showImage": "https://d3tlizm80tjdt4.cloudfront.net/remote_images/image/1998/small/92cb453b056d15b02a89fefb67e39797fc58b0a4398a29b53f.jpg",
  "text": "Cheese, Halloumi, Tradition, Greek, Import, 40/8.8 Oz (SKU: 124144) is a traditional Greek Halloumi cheese produced by the brand Alambra, categorized under Sliced Cheese. Each unit consists of 1 item with dimensions of L 1\" x W 1\" x H 1\" and a total weight of 20 lbs. The price for each unit is $197.35, which breaks down to $8.97 per pound. There are no active discounts for this product, and it is currently in stock. No related cheeses are listed for this particular SKU. This Halloumi has a price order rank of 1 and a popularity rank of 51. For more details and images, visit the product page: https://shop.kimelo.com/sku/cheese-halloumi-tradition-greek-import-4088-oz-124144/124144.",
  "weight_each": 20,
  "weight_unit": "lbs"
},
{
  "_id": {
    "$oid": "681daabade130bddf45fd092"
  },
  "sku": "103603",
  "brand": "California Select Farms",
  "count_unit": "Item",
  "department": "Sliced Cheese",
  "dimension_case": "L 1\" x W 1\" x H 1\"",
  "dimension_each": "L 1\" x W 1\" x H 1\"",
  "discount": "",
  "empty": false,
  "href": "https://shop.kimelo.com/sku/cheese-cheddar-sharp-slcd-interleaf-075-oz-8-103603/103603",
  "images": [
    "https://d3tlizm80tjdt4.cloudfront.net/image/10347/image/sm-e678c1718263a65a402310e22e32ac8a.jpg"
  ],
  "item_counts_case": 8,
  "item_counts_each": 1,
  "name": "Cheese, Cheddar, Sharp, Slcd, Interleaf, 0.75 Oz, (8)  103603",
  "popularity_order": 52,
  "price": 9.56,
  "pricePer": 6.37,
  "price_case": 76.48,
  "price_each": 9.56,
  "price_order": 91,
  "price_unit": "lb",
  "relateds": [
    "103600",
    "106815"
  ],
  "showImage": "https://d3tlizm80tjdt4.cloudfront.net/image/10347/image/sm-e678c1718263a65a402310e22e32ac8a.jpg",
  "text": "Cheese, Cheddar, Sharp, Slcd, Interleaf, 0.75 Oz, (8) 103603 is a sharp cheddar cheese made by California Select Farms, categorized under Sliced Cheese. One case includes 8 items, each with dimensions of L 1\" x W 1\" x H 1\" and a weight of 0.1875 lbs, for a total case weight of 1.5 lbs. The price is $76.48 per case and $9.56 for each item, with a price per pound of $6.37. The SKU number for this product is 103603, and related cheeses include SKUs 103600 and 106815. There is currently no discount offered for this cheese. The cheese is available in stock and not marked as empty. For more information or to purchase, you can visit the link: https://shop.kimelo.com/sku/cheese-cheddar-sharp-slcd-interleaf-075-oz-8-103603/103603.",
  "weight_case": 1.5,
  "weight_each": 0.1875,
  "weight_unit": "lbs"
},
{
  "_id": {
    "$oid": "681daabade130bddf45fd093"
  },
  "sku": "103599",
  "brand": "Cheese Crafters",
  "count_unit": "Item",
  "department": "Sliced Cheese",
  "dimension_case": "L 1\" x W 1\" x H 1\"",
  "dimension_each": "L 1\" x W 1\" x H 1\"",
  "discount": "",
  "empty": false,
  "href": "https://shop.kimelo.com/sku/cheese-monterey-jack-sliced-8-15-lb-103599/103599",
  "images": [
    "https://d3tlizm80tjdt4.cloudfront.net/image/9201/image/sm-4b09eacd768b0bf3bc71bca949fe2915.jpg"
  ],
  "item_counts_case": 8,
  "item_counts_each": 1,
  "name": "Cheese, Monterey Jack, Sliced, (8) 1.5 Lb - 103599",
  "popularity_order": 54,
  "price": 5.97,
  "pricePer": 3.98,
  "price_case": 47.76,
  "price_each": 5.97,
  "price_order": 97,
  "price_unit": "lb",
  "relateds": [
    "103562",
    "108930"
  ],
  "showImage": "https://d3tlizm80tjdt4.cloudfront.net/image/9201/image/sm-4b09eacd768b0bf3bc71bca949fe2915.jpg",
  "text": "Cheese, Monterey Jack, Sliced, (8) 1.5 Lb - 103599 is offered by the brand Cheese Crafters and falls under the Sliced Cheese department. Each case contains 8 individually packaged items, with each item weighing 0.1875 lbs and the full case weighing 1.5 lbs. The dimensions for both each unit and the case are L 1\" x W 1\" x H 1\". The price for an individual item (EACH) is $5.97, while the price for a CASE is $47.76, and the price per weight is $3.98 per pound. This product is currently available and has a SKU of 103599. Related cheeses include those with SKUs 103562 and 108930. For images and more details, visit https://shop.kimelo.com/sku/cheese-monterey-jack-sliced-8-15-lb-103599/103599. In terms of price order, it ranks 97th, and in popularity order, it ranks 54th.",
  "weight_case": 1.5,
  "weight_each": 0.1875,
  "weight_unit": "lbs"
},
{
  "_id": {
    "$oid": "681daabbde130bddf45fd094"
  },
  "sku": "107600",
  "brand": "Packer",
  "count_unit": "Item",
  "department": "Cheese Loaf",
  "dimension_case": "L 1\" x W 1\" x H 1\"",
  "dimension_each": "L 1\" x W 1\" x H 1\"",
  "discount": "",
  "empty": false,
  "href": "https://shop.kimelo.com/sku/cheese-monterey-jack-loaf-2-5-lb-107600/107600",
  "images": [
    "https://d3tlizm80tjdt4.cloudfront.net/image/5924/image/sm-a0e9d66341c1123c8815f8cc248af79b.jpg",
    "https://d3tlizm80tjdt4.cloudfront.net/image/5981/image/sm-8006f8100c50aee751d5e74b228445bf.jpg"
  ],
  "item_counts_case": 2,
  "item_counts_each": 1,
  "name": "Cheese, Monterey Jack, Loaf, (2) 5 Lb - 107600",
  "popularity_order": 55,
  "price": 18.45,
  "pricePer": 3.69,
  "price_case": 36.9,
  "price_each": 18.45,
  "price_order": 77,
  "price_unit": "lb",
  "relateds": [
    "103562"
  ],
  "showImage": "https://d3tlizm80tjdt4.cloudfront.net/image/5981/image/sm-8006f8100c50aee751d5e74b228445bf.jpg",
  "text": "Cheese, Monterey Jack, Loaf, (2) 5 Lb - 107600 is a product from the Packer brand in the Cheese Loaf department. Each case contains 2 items, with each loaf weighing 2.5 lbs, totaling 5 lbs per case. The dimensions for both each and case units are L 1\" x W 1\" x H 1\". The price is $18.45 per loaf and $36.90 per case, with a price per pound of $3.69/lb. This cheese is in stock and its SKU is 107600. Two images are available for reference, and it is related to SKU 103562. For more details or to purchase, visit https://shop.kimelo.com/sku/cheese-monterey-jack-loaf-2-5-lb-107600/107600.",
  "weight_case": 5,
  "weight_each": 2.5,
  "weight_unit": "lbs"
},
{
  "_id": {
    "$oid": "681daabbde130bddf45fd095"
  },
  "sku": "172026",
  "brand": "Kraft",
  "count_unit": "Item",
  "department": "Cream Cheese",
  "dimension_case": "L 1\" x W 1\" x H 1\"",
  "dimension_each": "L 1\" x W 1\" x H 1\"",
  "discount": "",
  "empty": false,
  "href": "https://shop.kimelo.com/sku/cheese-cream-cheese-whipped-tub-philadelphia-6-377753-sku-172026/172026",
  "images": [
    "https://d3tlizm80tjdt4.cloudfront.net/remote_images/image/14101/small/59becfe7880750956b1c39a81e7f2bfef3437a4b464a2f5a69.jpg"
  ],
  "item_counts_case": 6,
  "item_counts_each": 1,
  "name": "Cheese, Cream Cheese, Whipped Tub, Philadelphia (6) 377753 - Sku 172026",
  "popularity_order": 57,
  "price": 21.68,
  "pricePer": 7.23,
  "price_case": 130.08,
  "price_each": 21.68,
  "price_order": 72,
  "price_unit": "Lb",
  "relateds": [],
  "showImage": "https://d3tlizm80tjdt4.cloudfront.net/remote_images/image/14101/small/59becfe7880750956b1c39a81e7f2bfef3437a4b464a2f5a69.jpg",
  "text": "Cheese, Cream Cheese, Whipped Tub, Philadelphia (6) 377753 - Sku 172026 is a whipped cream cheese from the brand Kraft, categorized under Cream Cheese. Each case contains 6 items, with each tub weighing 3 lbs for a total case weight of 18 lbs. The dimensions for both case and each item are L 1\" x W 1\" x H 1\". The price is $21.68 per tub and $130.08 per case, with a price per pound of $7.23. There are currently no discounts available for this product, and it is in stock. The SKU for this cheese is 172026. For more information or to purchase, visit https://shop.kimelo.com/sku/cheese-cream-cheese-whipped-tub-philadelphia-6-377753-sku-172026/172026.",
  "weight_case": 18,
  "weight_each": 3,
  "weight_unit": "lbs"
},
{
  "_id": {
    "$oid": "681daabbde130bddf45fd096"
  },
  "sku": "108978",
  "brand": "Packer",
  "count_unit": "Item",
  "department": "Cheese Loaf",
  "dimension_case": "L 1\" x W 1\" x H 1\"",
  "dimension_each": "L 1\" x W 1\" x H 1\"",
  "discount": "",
  "empty": false,
  "href": "https://shop.kimelo.com/sku/cheese-gruyere-imported-loaf-2-5-lb-108978/108978",
  "images": [
    "https://d3tlizm80tjdt4.cloudfront.net/image/7423/image/sm-05cc51bafdb84958b8c527b8a3a8fecb.jpg",
    "https://d3tlizm80tjdt4.cloudfront.net/image/7424/image/sm-566e588743e706293efc53c0c727bca1.jpg"
  ],
  "item_counts_case": 2,
  "item_counts_each": 1,
  "name": "Cheese, Gruyere, Imported, Loaf, (2) 5 Lb - 108978",
  "popularity_order": 58,
  "price": 67.3,
  "pricePer": 13.46,
  "price_case": 134.6,
  "price_each": 67.3,
  "price_order": 34,
  "price_unit": "lb",
  "relateds": [],
  "showImage": "https://d3tlizm80tjdt4.cloudfront.net/image/7423/image/sm-05cc51bafdb84958b8c527b8a3a8fecb.jpg",
  "text": "Cheese, Gruyere, Imported, Loaf, (2) 5 Lb - 108978 is a specialty Gruyere cheese offered by Packer under the Cheese Loaf department. The product is available as a loaf, with each unit weighing 2.5 lbs and a case containing 2 such loaves for a total of 5 lbs. Dimensions for both the case and each loaf are L 1\" x W 1\" x H 1\". The price is $67.30 per loaf and $134.60 per case, with a rate of $13.46 per pound. Images of the cheese are available at https://d3tlizm80tjdt4.cloudfront.net/image/7423/image/sm-05cc51bafdb84958b8c527b8a3a8fecb.jpg and an additional reference image is also provided. The SKU for this cheese is 108978, it is currently in stock, and it can be viewed or purchased at https://shop.kimelo.com/sku/cheese-gruyere-imported-loaf-2-5-lb-108978/108978. There are no current discounts or listed related product SKUs. This cheese ranks 34th by price and 58th by popularity.",
  "weight_case": 5,
  "weight_each": 2.5,
  "weight_unit": "lbs"
},
{
  "_id": {
    "$oid": "681daabcde130bddf45fd097"
  },
  "sku": "373628",
  "brand": "Metsobo A.e.",
  "count_unit": "Item",
  "department": "Sliced Cheese",
  "dimension_case": "L 1\" x W 1\" x H 1\"",
  "dimension_each": "L 1\" x W 1\" x H 1\"",
  "discount": "",
  "empty": false,
  "href": "https://shop.kimelo.com/sku/cheese-saganaki-hard-greek-import-7-lb-avg-6-125801/373628",
  "images": [
    "https://d3tlizm80tjdt4.cloudfront.net/remote_images/image/8993/small/e5e6885ff13c2fe97bc05df189a3c03c0339d2260d615749a9.jpg"
  ],
  "item_counts_case": 6,
  "item_counts_each": 1,
  "name": "Cheese, Saganaki, Hard, Greek, Import, 7 Lb Avg (6) 125801",
  "popularity_order": 59,
  "price": 68.53,
  "pricePer": 9.79,
  "price_case": 411.18,
  "price_each": 68.53,
  "price_order": 33,
  "price_unit": "Lb",
  "relateds": [],
  "showImage": "https://d3tlizm80tjdt4.cloudfront.net/remote_images/image/8993/small/e5e6885ff13c2fe97bc05df189a3c03c0339d2260d615749a9.jpg",
  "text": "Cheese, Saganaki, Hard, Greek, Import, 7 Lb Avg (6) 125801 is a sliced cheese from the brand Metsobo A.e., categorized under \"Sliced Cheese.\" It is available in cases containing 6 items, with each item weighing 7 lbs, making a total case weight of 42 lbs. The dimensions for each unit and case are L 1\" x W 1\" x H 1\". The price for each cheese is $68.53, while a case costs $411.18, and the price per pound is $9.79. The cheese has a SKU of 373628 and there is currently no discount offered. This product is in stock, and more information or purchase can be found at https://shop.kimelo.com/sku/cheese-saganaki-hard-greek-import-7-lb-avg-6-125801/373628. The cheese ranks 33rd in price order and 59th in popularity order.",
  "weight_case": 42,
  "weight_each": 7,
  "weight_unit": "lbs"
},
{
  "_id": {
    "$oid": "681daabcde130bddf45fd098"
  },
  "sku": "112492",
  "brand": "Galbani Premio",
  "count_unit": "Item",
  "department": "Shredded Cheese",
  "dimension_each": "L 1\" x W 1\" x H 1\"",
  "discount": "Buy 10+ pay $98.46",
  "empty": false,
  "href": "https://shop.kimelo.com/sku/cheese-blend-mozz-wm-ps-premio-shred-65-lb-112492/112492",
  "images": [
    "https://d3tlizm80tjdt4.cloudfront.net/image/13860/image/sm-1505a5e7aa7570e69e7ca77cf4c49a97.png"
  ],
  "item_counts_each": 1,
  "name": "Cheese, Blend, Mozz, Wm & Ps, Premio Shred, 6/5 Lb - 112492",
  "popularity_order": 60,
  "price": 101.51,
  "pricePer": 3.38,
  "price_each": 101.51,
  "price_order": 18,
  "price_unit": "lb",
  "relateds": [],
  "showImage": "https://d3tlizm80tjdt4.cloudfront.net/image/13860/image/sm-1505a5e7aa7570e69e7ca77cf4c49a97.png",
  "text": "Cheese, Blend, Mozz, Wm & Ps, Premio Shred, 6/5 Lb - 112492 is a shredded cheese from the Galbani Premio brand, categorized under Shredded Cheese. Each unit contains 1 item with dimensions of L 1\" x W 1\" x H 1\" and a total weight of 30 lbs per unit. The price for each unit is $101.51, which breaks down to $3.38 per pound, and there is a discount available: buy 10 or more and pay $98.46 per unit. This cheese has no related cheese SKUs listed. The product is available for purchase and has a price order ranking of 18 and a popularity order ranking of 60. The SKU for this cheese is 112492, and more information or an image can be found at the provided link: https://shop.kimelo.com/sku/cheese-blend-mozz-wm-ps-premio-shred-65-lb-112492/112492.",
  "weight_each": 30,
  "weight_unit": "lbs"
},
{
  "_id": {
    "$oid": "681daabdde130bddf45fd099"
  },
  "sku": "103562",
  "brand": "Packer",
  "count_unit": "Item",
  "department": "Sliced Cheese",
  "dimension_each": "L 1\" x W 1\" x H 1\"",
  "discount": "",
  "empty": false,
  "href": "https://shop.kimelo.com/sku/cheese-monterey-jack-block-40-lb-avg-103562/103562",
  "images": [
    "https://d3tlizm80tjdt4.cloudfront.net/image/11519/image/sm-6f1eb10583921d3db8a9df08b378c1bd.jpeg",
    "https://d3tlizm80tjdt4.cloudfront.net/image/11520/image/sm-0578768dbf3717cac7921cb4e7968f03.jpeg"
  ],
  "item_counts_each": 1,
  "name": "Cheese, Monterey Jack, Block, 40 Lb Avg - 103562",
  "popularity_order": 62,
  "price": 112,
  "pricePer": 2.8,
  "price_each": 112,
  "price_order": 9,
  "price_unit": "lb",
  "relateds": [
    "107600"
  ],
  "showImage": "https://d3tlizm80tjdt4.cloudfront.net/image/11519/image/sm-6f1eb10583921d3db8a9df08b378c1bd.jpeg",
  "text": "The \"Cheese, Monterey Jack, Block, 40 Lb Avg - 103562\" is a Monterey Jack cheese produced by the brand Packer and categorized under Sliced Cheese. Each unit consists of one item weighing 40 lbs, with dimensions of L 1\" x W 1\" x H 1\". The cheese is available at a price of $112.00 per unit, which is equivalent to $2.80 per pound. Its SKU is 103562, and it is currently in stock. The product features two reference images and has a related cheese with SKU 107600. The cheese ranks 9th in price order and 62nd in popularity order. More information can be found at the shop link: https://shop.kimelo.com/sku/cheese-monterey-jack-block-40-lb-avg-103562/103562.",
  "weight_each": 40,
  "weight_unit": "lbs"
},
{
  "_id": {
    "$oid": "681daabdde130bddf45fd09a"
  },
  "sku": "111711",
  "brand": "Galbani",
  "count_unit": "Item",
  "department": "Shredded Cheese",
  "dimension_case": "L 1\" x W 1\" x H 1\"",
  "dimension_each": "L 1\" x W 1\" x H 1\"",
  "discount": "",
  "empty": false,
  "href": "https://shop.kimelo.com/sku/cheese-asiago-shredded-6-5-lb-111711/111711",
  "images": [
    "https://d3tlizm80tjdt4.cloudfront.net/image/11540/image/sm-dc389e1a3b99419ba379e3fb3916db94.png"
  ],
  "item_counts_case": 6,
  "item_counts_each": 1,
  "name": "Cheese, Asiago, Shredded, (6) 5 Lb - 111711",
  "popularity_order": 63,
  "price": 26.06,
  "pricePer": 5.21,
  "price_case": 156.36,
  "price_each": 26.06,
  "price_order": 70,
  "price_unit": "lb",
  "relateds": [
    "112306",
    "106816"
  ],
  "showImage": "https://d3tlizm80tjdt4.cloudfront.net/image/11540/image/sm-dc389e1a3b99419ba379e3fb3916db94.png",
  "text": "The cheese \"Cheese, Asiago, Shredded, (6) 5 Lb - 111711\" is produced by the brand Galbani and falls under the category of Shredded Cheese. Each case contains 6 individual items, with each item weighing approximately 0.83 lbs and each case weighing 5 lbs. The dimensions for both case and each unit are L 1\" x W 1\" x H 1\". The price is $26.06 per each and $156.36 per case, with a cost per pound of $5.21. Related cheeses by SKU are 112306 and 106816. There are no current discounts, and the product is available in-store, not empty. You can find a preview image at https://d3tlizm80tjdt4.cloudfront.net/image/11540/image/sm-dc389e1a3b99419ba379e3fb3916db94.png and more details at https://shop.kimelo.com/sku/cheese-asiago-shredded-6-5-lb-111711/111711. The SKU is 111711, the product ranks 70th in price and 63rd in popularity.",
  "weight_case": 5,
  "weight_each": 0.833333,
  "weight_unit": "lbs"
},
{
  "_id": {
    "$oid": "681daabdde130bddf45fd09b"
  },
  "sku": "123784",
  "brand": "Galbani",
  "count_unit": "Item",
  "department": "Shredded Cheese",
  "dimension_each": "L 1\" x W 1\" x H 1\"",
  "discount": "",
  "empty": false,
  "href": "https://shop.kimelo.com/sku/cheese-5-blend-moz-wmlmlmpsprovparmroma-65-lb-123784/123784",
  "images": [
    "https://d3tlizm80tjdt4.cloudfront.net/remote_images/image/7464/small/4c120c44089fd73a9dc6802b21106ba43711bda636e75afc96.jpg"
  ],
  "item_counts_each": 1,
  "name": "Cheese, 5 Blend, Moz Wmlm/lmps/prov/parm/roma, 6/5 Lb - 123784",
  "popularity_order": 64,
  "price": 96.18,
  "pricePer": 3.21,
  "price_each": 96.18,
  "price_order": 21,
  "price_unit": "lb",
  "relateds": [
    "103664"
  ],
  "showImage": "https://d3tlizm80tjdt4.cloudfront.net/remote_images/image/7464/small/4c120c44089fd73a9dc6802b21106ba43711bda636e75afc96.jpg",
  "text": "The \"Cheese, 5 Blend, Moz Wmlm/lmps/prov/parm/roma, 6/5 Lb - 123784\" is a shredded cheese blend from the brand Galbani, categorized under Shredded Cheese. Each unit contains 1 item with dimensions of L 1\" x W 1\" x H 1\" and a weight of 30 lbs. The price for each unit is $96.18, which comes out to $3.21 per pound. The product’s SKU is 123784, and it has a related item with SKU 103664. There are preview and reference images available at the provided URL. Currently, the product is available for purchase, with no active discounts. You can find more details or place an order at https://shop.kimelo.com/sku/cheese-5-blend-moz-wmlmlmpsprovparmroma-65-lb-123784/123784. This cheese holds a price order rank of 21 and a popularity order rank of 64.",
  "weight_each": 30,
  "weight_unit": "lbs"
},
{
  "_id": {
    "$oid": "681daabede130bddf45fd09c"
  },
  "sku": "123797",
  "brand": "Valbreso",
  "count_unit": "Item",
  "department": "Specialty Cheese",
  "dimension_each": "L 1\" x W 1\" x H 1\"",
  "discount": "",
  "empty": false,
  "href": "https://shop.kimelo.com/sku/cheese-feta-french-pail-valbreso-18-lb-avg-123797/123797",
  "images": [
    "https://d3tlizm80tjdt4.cloudfront.net/image/17988/image/sm-82414835d395197c5f8390f295a0f0fe.jpg"
  ],
  "item_counts_each": 1,
  "name": "Cheese, Feta, French, Pail, Valbreso, 18 Lb Avg - 123797",
  "popularity_order": 65,
  "price": 125.1,
  "pricePer": 6.95,
  "price_each": 125.1,
  "price_order": 7,
  "price_unit": "lb",
  "relateds": [],
  "showImage": "https://d3tlizm80tjdt4.cloudfront.net/image/17988/image/sm-82414835d395197c5f8390f295a0f0fe.jpg",
  "text": "Cheese, Feta, French, Pail, Valbreso, 18 Lb Avg (SKU: 123797) is a specialty cheese offered by the brand Valbreso. This cheese comes in a single pail unit, each weighing approximately 18 lbs, with dimensions of L 1\" x W 1\" x H 1\". It is categorized under Specialty Cheese and is not currently out of stock. The price for one unit is $125.10, making the cost $6.95 per pound. There are no discounts currently available for this product, and there are no related cheese products listed. For more details or to purchase, visit: https://shop.kimelo.com/sku/cheese-feta-french-pail-valbreso-18-lb-avg-123797/123797. This cheese ranks 7th in price order and 65th in popularity order.",
  "weight_each": 18,
  "weight_unit": "lbs"
},
{
  "_id": {
    "$oid": "681daabede130bddf45fd09d"
  },
  "sku": "374448",
  "brand": "Packer",
  "count_unit": "Item",
  "department": "Cream Cheese",
  "dimension_each": "L 1\" x W 1\" x H 1\"",
  "discount": "",
  "empty": false,
  "href": "https://shop.kimelo.com/sku/cheese-cream-bulk-frozen-30-lb/374448",
  "images": [
    "https://d3tlizm80tjdt4.cloudfront.net/remote_images/image/9503/small/c20e0679de38f6e24091a6d1a19b28f6ec8d244a5fb5adbe48.jpg"
  ],
  "item_counts_each": 1,
  "name": "Cheese, Cream, Bulk, Frozen, 30 Lb",
  "popularity_order": 66,
  "price": 44.92,
  "pricePer": 1.5,
  "price_each": 44.92,
  "price_order": 48,
  "price_unit": "Lb",
  "relateds": [],
  "showImage": "https://d3tlizm80tjdt4.cloudfront.net/remote_images/image/9503/small/c20e0679de38f6e24091a6d1a19b28f6ec8d244a5fb5adbe48.jpg",
  "text": "Cheese, Cream, Bulk, Frozen, 30 Lb is a cream cheese product from the brand Packer, categorized under Cream Cheese. Each item consists of one bulk package weighing 30 lbs, with dimensions of L 1\" x W 1\" x H 1\". The price for each unit is $44.92, making it $1.50 per pound. The SKU for this product is 374448 and it is currently available in the shop. There are no related cheeses or active discounts offered for this item. For more details or to purchase, visit the product link: https://shop.kimelo.com/sku/cheese-cream-bulk-frozen-30-lb/374448. This cheese ranks 48th by price and 66th in popularity. Reference images can be found at the provided image URL.",
  "weight_each": 30,
  "weight_unit": "lbs"
},
{
  "_id": {
    "$oid": "681daabfde130bddf45fd09e"
  },
  "sku": "106815",
  "brand": "Tillamook",
  "count_unit": "Item",
  "department": "Cheese Loaf",
  "dimension_case": "L 1\" x W 1\" x H 1\"",
  "dimension_each": "L 1\" x W 1\" x H 1\"",
  "discount": "",
  "empty": false,
  "href": "https://shop.kimelo.com/sku/cheese-cheddar-medium-loaf-2-5lb-106815/106815",
  "images": [
    "https://d3tlizm80tjdt4.cloudfront.net/image/2254/image/sm-cd0c941b11ba4b342c17c421fe3e4d95.jpeg"
  ],
  "item_counts_case": 2,
  "item_counts_each": 1,
  "name": "Cheese, Cheddar, Medium, Loaf, (2) 5lb - 106815",
  "popularity_order": 67,
  "price": 30.08,
  "pricePer": 6.02,
  "price_case": 60.16,
  "price_each": 30.08,
  "price_order": 64,
  "price_unit": "lb",
  "relateds": [
    "103670"
  ],
  "showImage": "https://d3tlizm80tjdt4.cloudfront.net/image/2254/image/sm-cd0c941b11ba4b342c17c421fe3e4d95.jpeg",
  "text": "Cheese, Cheddar, Medium, Loaf, (2) 5lb - 106815 is a medium cheddar cheese loaf from the brand Tillamook, categorized under Cheese Loaf. Each case contains 2 individual cheese loaves, with each loaf weighing 2.5 lbs, totaling to 5 lbs per case. The dimensions for each item and case are both L 1\" x W 1\" x H 1\". The price is $30.08 per loaf (each) or $60.16 per case, with a unit price of $6.02 per pound. The SKU for this product is 106815, and it has a related cheese with SKU 103670. There is currently no discount available, and the product is in stock. For more information or to purchase, visit https://shop.kimelo.com/sku/cheese-cheddar-medium-loaf-2-5lb-106815/106815.",
  "weight_case": 5,
  "weight_each": 2.5,
  "weight_unit": "lbs"
},
{
  "_id": {
    "$oid": "681daabfde130bddf45fd09f"
  },
  "sku": "125736",
  "brand": "Krinos",
  "count_unit": "Item",
  "department": "Sliced Cheese",
  "dimension_each": "L 1\" x W 1\" x H 1\"",
  "discount": "",
  "empty": false,
  "href": "https://shop.kimelo.com/sku/cheese-manouri-log-greek-imported-45-lb-125736/125736",
  "images": [
    "https://d3tlizm80tjdt4.cloudfront.net/remote_images/image/7223/small/10d8ce04c768520771ad150340f03f5d6e9d96b8f373592dd4.jpg"
  ],
  "item_counts_each": 1,
  "name": "Cheese, Manouri, Log, Greek, Imported, 4/5 Lb 125736",
  "popularity_order": 68,
  "price": 139.32,
  "pricePer": 6.97,
  "price_each": 139.32,
  "price_order": 6,
  "price_unit": "lb",
  "relateds": [],
  "showImage": "https://d3tlizm80tjdt4.cloudfront.net/remote_images/image/7223/small/10d8ce04c768520771ad150340f03f5d6e9d96b8f373592dd4.jpg",
  "text": "Cheese, Manouri, Log, Greek, Imported, 4/5 Lb 125736 is a specialty cheese from the brand Krinos, categorized under Sliced Cheese. Each unit consists of one item with a weight of 20 lbs and dimensions of L 1\" x W 1\" x H 1\". The cheese is priced at $139.32 per item, with a price per pound of $6.97. This product is available for purchase and has the SKU 125736. There are no current discounts or related products listed for this cheese. The product image can be viewed at https://d3tlizm80tjdt4.cloudfront.net/remote_images/image/7223/small/10d8ce04c768520771ad150340f03f5d6e9d96b8f373592dd4.jpg, and more details are available at https://shop.kimelo.com/sku/cheese-manouri-log-greek-imported-45-lb-125736/125736. In terms of store sorting, it ranks 6th by highest price and 68th by popularity.",
  "weight_each": 20,
  "weight_unit": "lbs"
},
{
  "_id": {
    "$oid": "681daabfde130bddf45fd0a0"
  },
  "sku": "112545",
  "brand": "Galbani",
  "count_unit": "Item",
  "department": "Cheese Loaf",
  "dimension_each": "L 1\" x W 1\" x H 1\"",
  "discount": "",
  "empty": false,
  "href": "https://shop.kimelo.com/sku/cheese-mozzarella-fresh-loaf-thin-slice-61-lb-112545/112545",
  "images": [
    "https://d3tlizm80tjdt4.cloudfront.net/image/13746/image/sm-6e810ecb0cadc532f8c04cabb747fdf2.png",
    "https://d3tlizm80tjdt4.cloudfront.net/remote_images/image/7206/small/cadf53e1327c3239a7357615e615e12fb356c54371de4703e9.jpg"
  ],
  "item_counts_each": 1,
  "name": "Cheese, Mozzarella, Fresh, Loaf, Thin Slice, 6/1 Lb - 112545",
  "popularity_order": 69,
  "price": 34.55,
  "pricePer": 5.76,
  "price_each": 34.55,
  "price_order": 58,
  "price_unit": "lb",
  "relateds": [
    "123382"
  ],
  "showImage": "https://d3tlizm80tjdt4.cloudfront.net/image/13746/image/sm-6e810ecb0cadc532f8c04cabb747fdf2.png",
  "text": "Cheese, Mozzarella, Fresh, Loaf, Thin Slice, 6/1 Lb - 112545 is a specialty cheese product from the Galbani brand, categorized under Cheese Loaf. Each item weighs 6 lbs and has dimensions of L 1\" x W 1\" x H 1\". The price for each loaf is $34.55, which equates to $5.76 per pound. This cheese is available for purchase at the following link: https://shop.kimelo.com/sku/cheese-mozzarella-fresh-loaf-thin-slice-61-lb-112545/112545, and it is not currently out of stock. The item includes two reference images and is related to the product with SKU 123382. Its price ranking is 58th, while its popularity ranking is 69th among other cheeses offered.",
  "weight_each": 6,
  "weight_unit": "lbs"
},
{
  "_id": {
    "$oid": "681daac0de130bddf45fd0a1"
  },
  "sku": "374193",
  "brand": "Galbani Premio",
  "count_unit": "Item",
  "department": "Specialty Cheese",
  "dimension_each": "L 1\" x W 1\" x H 1\"",
  "discount": "",
  "empty": false,
  "href": "https://shop.kimelo.com/sku/cheese-mozzarella-lmps-loaf-premio-85-lb/374193",
  "images": [
    "https://d3tlizm80tjdt4.cloudfront.net/remote_images/image/8358/small/b2822f77cb40a483ec292d837dbfcea6b8be7f2e39cc90e6ca.jpg"
  ],
  "item_counts_each": 1,
  "name": "Cheese, Mozzarella, Lmps, Loaf, Premio, 8/5 Lb",
  "popularity_order": 72,
  "price": 102.95,
  "pricePer": 12.87,
  "price_each": 102.95,
  "price_order": 17,
  "price_unit": "loaf",
  "relateds": [],
  "showImage": "https://d3tlizm80tjdt4.cloudfront.net/remote_images/image/8358/small/b2822f77cb40a483ec292d837dbfcea6b8be7f2e39cc90e6ca.jpg",
  "text": "Cheese, Mozzarella, LMPS, Loaf, Premio, 8/5 Lb is a specialty cheese product from the Galbani Premio brand. It belongs to the Specialty Cheese department and is listed under SKU 374193. Each unit consists of 1 loaf, with dimensions of L 1\" x W 1\" x H 1\" and a total weight of 40 lbs. The price for each loaf is $102.95, with a price per loaf of $12.87. No discounts are currently available, and this product is in stock. For more details and to view the cheese, visit the product link: https://shop.kimelo.com/sku/cheese-mozzarella-lmps-loaf-premio-85-lb/374193. There are no related products listed for this item, and its popularity order is 72 out of all cheeses.",
  "weight_each": 40,
  "weight_unit": "lbs"
},
{
  "_id": {
    "$oid": "681daac0de130bddf45fd0a2"
  },
  "sku": "374196",
  "brand": "Galbani Premio",
  "count_unit": "Item",
  "department": "Specialty Cheese",
  "dimension_each": "L 1\" x W 1\" x H 1\"",
  "discount": "",
  "empty": false,
  "href": "https://shop.kimelo.com/sku/cheese-mozzarella-wmlm-loaf-premio-85-lb/374196",
  "images": [
    "https://d3tlizm80tjdt4.cloudfront.net/remote_images/image/8390/small/53b845e1fb7106fdd945620096b458f0828fadee1fe5d5d0e8.jpg"
  ],
  "item_counts_each": 1,
  "name": "Cheese, Mozzarella, Wmlm, Loaf, Premio, 8/5 Lb",
  "popularity_order": 73,
  "price": 108.52,
  "pricePer": 10.85,
  "price_each": 108.52,
  "price_order": 13,
  "price_unit": "loaf",
  "relateds": [],
  "showImage": "https://d3tlizm80tjdt4.cloudfront.net/remote_images/image/8390/small/53b845e1fb7106fdd945620096b458f0828fadee1fe5d5d0e8.jpg",
  "text": "Cheese, Mozzarella, Wmlm, Loaf, Premio, 8/5 Lb is a specialty cheese offered by Galbani Premio. This product belongs to the Specialty Cheese department and comes as one unit per package, weighing 40 lbs with dimensions of L 1\" x W 1\" x H 1\". The price for each unit is $108.52, equating to $10.85 per loaf. The SKU for this cheese is 374196, and it is currently in stock. There are no related cheeses linked to this item and no active discounts available. For more details or to purchase, visit https://shop.kimelo.com/sku/cheese-mozzarella-wmlm-loaf-premio-85-lb/374196. Its price order is 13 and its popularity order is 73.",
  "weight_each": 40,
  "weight_unit": "lbs"
},
{
  "_id": {
    "$oid": "681daac1de130bddf45fd0a3"
  },
  "sku": "374567",
  "brand": "Galbani",
  "count_unit": "Item",
  "department": "Specialty Cheese",
  "dimension_each": "L 1\" x W 1\" x H 1\"",
  "discount": "",
  "empty": false,
  "href": "https://shop.kimelo.com/sku/cheese-mozzarella-frozen-ovoline-galbani-23-lb/374567",
  "images": [
    "https://d3tlizm80tjdt4.cloudfront.net/remote_images/image/10806/small/080a48a561d13a90309f06536874d86ca67cf124dc3961482d.jpg"
  ],
  "item_counts_each": 1,
  "name": "Cheese, Mozzarella, Frozen, Ovoline, Galbani, 2/3 Lb",
  "popularity_order": 74,
  "price": 14.64,
  "pricePer": 2.44,
  "price_each": 14.64,
  "price_order": 89,
  "price_unit": "Lb",
  "relateds": [],
  "showImage": "https://d3tlizm80tjdt4.cloudfront.net/remote_images/image/10806/small/080a48a561d13a90309f06536874d86ca67cf124dc3961482d.jpg",
  "text": "Cheese, Mozzarella, Frozen, Ovoline, Galbani, 2/3 Lb is a specialty cheese product by the brand Galbani. It is categorized under Specialty Cheese and comes in one unit per package, with each unit weighing 6 lbs. The dimensions of each unit are L 1\" x W 1\" x H 1\". The cheese is priced at $14.64 per unit, with a price per pound of $2.44. There are no related products or current discounts available for this SKU (374567). This cheese is in stock and can be viewed online at https://shop.kimelo.com/sku/cheese-mozzarella-frozen-ovoline-galbani-23-lb/374567. The image preview is available at https://d3tlizm80tjdt4.cloudfront.net/remote_images/image/10806/small/080a48a561d13a90309f06536874d86ca67cf124dc3961482d.jpg.",
  "weight_each": 6,
  "weight_unit": "lbs"
},
{
  "_id": {
    "$oid": "681daac1de130bddf45fd0a4"
  },
  "sku": "342870",
  "brand": "Kolios",
  "count_unit": "Item",
  "department": "Specialty Cheese",
  "dimension_each": "L 1\" x W 1\" x H 1\"",
  "discount": "",
  "empty": false,
  "href": "https://shop.kimelo.com/sku/cheese-feta-greek-sheep-112-kg-124849/342870",
  "images": [
    "https://d3tlizm80tjdt4.cloudfront.net/remote_images/image/13368/small/1407ffca973704e384634cd27285dbec2bccd8ea94f56171e1.jpg"
  ],
  "item_counts_each": 1,
  "name": "Cheese, Feta, Greek, Sheep, 1/12 Kg 124849",
  "popularity_order": 75,
  "price": 162,
  "pricePer": 0,
  "price_each": 162,
  "price_order": 3,
  "price_unit": "lb",
  "relateds": [],
  "showImage": "https://d3tlizm80tjdt4.cloudfront.net/remote_images/image/13368/small/1407ffca973704e384634cd27285dbec2bccd8ea94f56171e1.jpg",
  "text": "Kolios Cheese, Feta, Greek, Sheep, 1/12 Kg (SKU: 342870) is a specialty cheese offered in the \"Specialty Cheese\" category. Each item weighs 15 lbs and has dimensions of L 1\" x W 1\" x H 1\". The price per item is $162.00, with a price per pound listed as $0/lb. The product does not have any discounts and is currently available for purchase. The cheese is presented as a single item unit, and there are no related cheeses associated with this SKU. It holds a price order of 3 and a popularity order of 75. For more details or to purchase, visit: https://shop.kimelo.com/sku/cheese-feta-greek-sheep-112-kg-124849/342870.",
  "weight_each": 15,
  "weight_unit": "lbs"
},
{
  "_id": {
    "$oid": "681daac2de130bddf45fd0a6"
  },
  "sku": "172091",
  "brand": "Packer",
  "count_unit": "Item",
  "department": "Specialty Cheese",
  "dimension_case": "L 1\" x W 1\" x H 1\"",
  "dimension_each": "L 1\" x W 1\" x H 1\"",
  "discount": "",
  "empty": false,
  "href": "https://shop.kimelo.com/sku/cheese-muenster-loaf-6-5-lbssku-172091/172091",
  "images": [
    "https://d3tlizm80tjdt4.cloudfront.net/remote_images/image/14165/small/0158d18ec81507169591cc645a9fff7c6f09c04889186230a6.jpg"
  ],
  "item_counts_case": 6,
  "item_counts_each": 1,
  "name": "Cheese, Muenster, Loaf (6) 5 Lbs,sku 172091",
  "popularity_order": 77,
  "price": 32.9,
  "pricePer": 6.58,
  "price_case": 197.4,
  "price_each": 32.9,
  "price_order": 62,
  "price_unit": "Lb",
  "relateds": [],
  "showImage": "https://d3tlizm80tjdt4.cloudfront.net/remote_images/image/14165/small/0158d18ec81507169591cc645a9fff7c6f09c04889186230a6.jpg",
  "text": "Cheese, Muenster, Loaf (6) 5 Lbs, sku 172091 is a specialty cheese from the brand Packer. This product comes in a case containing 6 individual loaves, each weighing 5 lbs, for a total case weight of 30 lbs. The dimensions for both case and each loaf are L 1\" x W 1\" x H 1\". The price for one loaf (EACH) is $32.90, while a full case is priced at $197.40. The current price per pound is $6.58, and there is no discount available at this time. The SKU for this cheese is 172091 and it is available for purchase with no reported stock issues. For more details or to purchase, see the product page: https://shop.kimelo.com/sku/cheese-muenster-loaf-6-5-lbssku-172091/172091",
  "weight_case": 30,
  "weight_each": 5,
  "weight_unit": "lbs"
},
{
  "_id": {
    "$oid": "681daac2de130bddf45fd0a7"
  },
  "sku": "123794",
  "brand": "Cheswick",
  "count_unit": "Item",
  "department": "Shredded Cheese",
  "dimension_each": "L 1\" x W 1\" x H 1\"",
  "discount": "",
  "empty": false,
  "href": "https://shop.kimelo.com/sku/cheese-pepperjack-feather-shred-45-lb-123794/123794",
  "images": [
    "https://d3tlizm80tjdt4.cloudfront.net/image/17990/image/sm-83f15352ef57aee10ecf9f5eacd4c835.png"
  ],
  "item_counts_each": 1,
  "name": "Cheese, Pepperjack, Feather Shred, 4/5 Lb - 123794",
  "popularity_order": 78,
  "price": 65.72,
  "pricePer": 3.29,
  "price_each": 65.72,
  "price_order": 35,
  "price_unit": "lb",
  "relateds": [
    "103672",
    "108930"
  ],
  "showImage": "https://d3tlizm80tjdt4.cloudfront.net/image/17990/image/sm-83f15352ef57aee10ecf9f5eacd4c835.png",
  "text": "Cheese, Pepperjack, Feather Shred, 4/5 Lb - 123794 is a shredded cheese product by Cheswick, categorized under Shredded Cheese. Each unit consists of 1 item weighing 20 lbs, with dimensions of L 1\" x W 1\" x H 1\". The price per item is $65.72, which breaks down to $3.29 per pound. The product can be previewed at https://d3tlizm80tjdt4.cloudfront.net/image/17990/image/sm-83f15352ef57aee10ecf9f5eacd4c835.png and more details are available at https://shop.kimelo.com/sku/cheese-pepperjack-feather-shred-45-lb-123794/123794. Related products include SKUs 103672 and 108930. The stock keeping unit (SKU) is 123794, and there are currently no discounts available. This cheese ranks 35th by price and 78th by popularity, with availability confirmed in the shop.",
  "weight_each": 20,
  "weight_unit": "lbs"
},
{
  "_id": {
    "$oid": "681daac2de130bddf45fd0a8"
  },
  "sku": "124109",
  "brand": "Zerto",
  "count_unit": "Item",
  "department": "Sliced Cheese",
  "dimension_each": "L 1\" x W 1\" x H 1\"",
  "discount": "",
  "empty": false,
  "href": "https://shop.kimelo.com/sku/cheese-pecorino-romano-14-lb-124109/124109",
  "images": [
    "https://d3tlizm80tjdt4.cloudfront.net/remote_images/image/7585/small/6fdb15f3fb9a8218f44f4394daed962b794d29364f31ec757a.jpg"
  ],
  "item_counts_each": 1,
  "name": "Cheese, Pecorino, Romano, 14 Lb 124109",
  "popularity_order": 92,
  "price": 71.25,
  "pricePer": 5.09,
  "price_each": 71.25,
  "price_order": 31,
  "price_unit": "lb",
  "relateds": [],
  "showImage": "https://d3tlizm80tjdt4.cloudfront.net/remote_images/image/7585/small/6fdb15f3fb9a8218f44f4394daed962b794d29364f31ec757a.jpg",
  "text": "Cheese, Pecorino, Romano, 14 Lb 124109 is a sliced cheese offered by the brand Zerto. It belongs to the Sliced Cheese department and comes in a single item unit weighing 14 lbs, with dimensions of L 1\" x W 1\" x H 1\". The price for each unit is $71.25, which equals $5.09 per pound. The product SKU is 124109 and it does not currently offer any discounts. The cheese is available in stock, and its popularity order is 92 while its price order is 31. For more details or to purchase, visit https://shop.kimelo.com/sku/cheese-pecorino-romano-14-lb-124109/124109.",
  "weight_each": 14,
  "weight_unit": "lbs"
},
{
  "_id": {
    "$oid": "681daac3de130bddf45fd0a9"
  },
  "sku": "172034",
  "brand": "Organic Valley",
  "count_unit": "Item",
  "department": "Specialty Cheese",
  "dimension_each": "L 1\" x W 1\" x H 1\"",
  "discount": "",
  "empty": false,
  "href": "https://shop.kimelo.com/sku/cheese-stringles-string-mozzarella-organic-241-oz-ct-10278-sku-172034/172034",
  "images": [
    "https://d3tlizm80tjdt4.cloudfront.net/remote_images/image/14108/small/d36c33635977c041d652f1f7a3af8c01abffa2f2456ec7c315.jpg"
  ],
  "item_counts_each": 1,
  "name": "Cheese, Stringles String Mozzarella, Organic 24/1 Oz Ct , 10278 - Sku 172034",
  "popularity_order": 95,
  "price": 20.65,
  "pricePer": 0.86,
  "price_each": 20.65,
  "price_order": 74,
  "price_unit": "ct",
  "relateds": [],
  "showImage": "https://d3tlizm80tjdt4.cloudfront.net/remote_images/image/14108/small/d36c33635977c041d652f1f7a3af8c01abffa2f2456ec7c315.jpg",
  "text": "Cheese, Stringles String Mozzarella, Organic 24/1 Oz Ct, SKU 172034, is a specialty cheese from the brand Organic Valley. This cheese belongs to the Specialty Cheese department and comes in a single item package with dimensions of L 1\" x W 1\" x H 1\". Each unit weighs 1.5 lbs and features a preview image available at the provided link. The cheese is sold for $20.65 each, with a price per count of $0.86/ct. There are currently no related SKU items or discount offers for this product. It is available for purchase at the shop, ranked 74th by price and 95th by popularity. For more details, you can visit the product page at the given URL.",
  "weight_each": 1.5,
  "weight_unit": "lbs"
},
{
  "_id": {
    "$oid": "681daac3de130bddf45fd0aa"
  },
  "sku": "172111",
  "brand": "Tillamook",
  "count_unit": "Item",
  "department": "Sliced Cheese",
  "dimension_each": "L 1\" x W 1\" x H 1\"",
  "discount": "",
  "empty": false,
  "href": "https://shop.kimelo.com/sku/cheese-cheddar-sharp-white-100075-oz-oz-tillamook-613897-sku-172111/172111",
  "images": [
    "https://d3tlizm80tjdt4.cloudfront.net/remote_images/image/14324/small/5211137065f5e986902c6a62fa4eb3f764ed76d03efbf7a3b2.jpg"
  ],
  "item_counts_each": 1,
  "name": "Cheese, Cheddar, Sharp White, 100/0.75 Oz Oz Tillamook 613897, Sku 172111",
  "popularity_order": 96,
  "price": 49.8,
  "pricePer": 0.5,
  "price_each": 49.8,
  "price_order": 43,
  "price_unit": "ct",
  "relateds": [],
  "showImage": "https://d3tlizm80tjdt4.cloudfront.net/remote_images/image/14324/small/5211137065f5e986902c6a62fa4eb3f764ed76d03efbf7a3b2.jpg",
  "text": "Cheese, Cheddar, Sharp White is a sliced cheese from the brand Tillamook, categorized under Sliced Cheese. Each unit contains 1 item with dimensions of L 1\" x W 1\" x H 1\" and a total weight of 4.69 lbs. The price for each unit is $49.80, and the price per count is $0.50/ct. The SKU for this product is 172111. There is no current discount available, and the product is in stock. This cheese ranks 43rd in price and 96th in popularity. More details and a preview image can be found at the provided link: https://shop.kimelo.com/sku/cheese-cheddar-sharp-white-100075-oz-oz-tillamook-613897-sku-172111/172111.",
  "weight_each": 4.69,
  "weight_unit": "lbs"
},
{
  "_id": {
    "$oid": "681daac4de130bddf45fd0ab"
  },
  "sku": "172119",
  "brand": "Laughing Cow",
  "count_unit": "Item",
  "department": "Specialty Cheese",
  "dimension_each": "L 1\" x W 1\" x H 1\"",
  "discount": "",
  "empty": false,
  "href": "https://shop.kimelo.com/sku/cheese-mini-babybel-red-wrap-72075-oz-sku-172119/172119",
  "images": [
    "https://d3tlizm80tjdt4.cloudfront.net/remote_images/image/15042/small/4752a482739aa892814722431a3b0e1a4930af59437ce4920d.jpg"
  ],
  "item_counts_each": 1,
  "name": "Cheese, Mini, Babybel (red Wrap) 72/0.75 Oz, Sku 172119",
  "popularity_order": 97,
  "price": 51.29,
  "pricePer": 0.71,
  "price_each": 51.29,
  "price_order": 41,
  "price_unit": "ct",
  "relateds": [],
  "showImage": "https://d3tlizm80tjdt4.cloudfront.net/remote_images/image/15042/small/4752a482739aa892814722431a3b0e1a4930af59437ce4920d.jpg",
  "text": "Cheese, Mini, Babybel (red Wrap) 72/0.75 Oz, Sku 172119, is a specialty cheese offered by Laughing Cow. This product falls under the Specialty Cheese department and is sold as individual items, each with dimensions of L 1\" x W 1\" x H 1\". Each unit weighs 4 lbs and is priced at $51.29, with a price per count of $0.71/ct. The cheese can be viewed through its preview image at the provided URL. There are currently no related cheeses listed for this SKU. The product is available for purchase and does not have any current discounts. For more details, you can visit its online listing at the given link.",
  "weight_each": 4,
  "weight_unit": "lbs"
},
{
  "_id": {
    "$oid": "681daac4de130bddf45fd0ac"
  },
  "sku": "172052",
  "brand": "Good Culture",
  "count_unit": "Item",
  "department": "Cottage Cheese",
  "dimension_each": "L 1\" x W 1\" x H 1\"",
  "discount": "",
  "empty": false,
  "href": "https://shop.kimelo.com/sku/cottage-cheese-classic-organic-125-oz-84778-sku-172052/172052",
  "images": [
    "https://d3tlizm80tjdt4.cloudfront.net/remote_images/image/14127/small/8d497ba0b199b319f4f58febfebec4619b58c4763daff721fd.jpg"
  ],
  "item_counts_each": 1,
  "name": "Cottage Cheese, Classic, Organic 12/5 Oz, 84778, Sku 172052",
  "popularity_order": 98,
  "price": 39.93,
  "pricePer": 3.33,
  "price_each": 39.93,
  "price_order": 54,
  "price_unit": "ct",
  "relateds": [],
  "showImage": "https://d3tlizm80tjdt4.cloudfront.net/remote_images/image/14127/small/8d497ba0b199b319f4f58febfebec4619b58c4763daff721fd.jpg",
  "text": "Cottage Cheese, Classic, Organic 12/5 Oz (SKU: 172052) is a product from Good Culture in the Cottage Cheese department. Each unit contains 1 item, with a total weight of 3.75 lbs and dimensions of L 1\" x W 1\" x H 1\". The price for each unit is $39.93, which translates to $3.33 per count. There are no related items or discounts currently available for this cheese. The product is in stock and can be viewed online at its product link. It holds price order 54 and popularity order 98 among the available cheeses. A preview image is provided for easy identification.",
  "weight_each": 3.75,
  "weight_unit": "lbs"
},
{
  "_id": {
    "$oid": "681daac4de130bddf45fd0ad"
  },
  "sku": "124603",
  "brand": "Galbani",
  "count_unit": "Item",
  "department": "Shredded Cheese",
  "dimension_case": "L 1\" x W 1\" x H 1\"",
  "dimension_each": "L 1\" x W 1\" x H 1\"",
  "discount": "",
  "empty": true,
  "href": "https://shop.kimelo.com/sku/cheese-parmesan-shredded-6-5-lb-124603/124603",
  "images": [
    "https://d3tlizm80tjdt4.cloudfront.net/remote_images/image/2650/small/8ccc10b43c0da13a2feaa26d6af00080d864418c35ce1b4439.jpg"
  ],
  "item_counts_case": 6,
  "item_counts_each": 1,
  "name": "Cheese, Parmesan, Shredded, (6) 5 Lb - 124603",
  "popularity_order": 4,
  "price": 26.88,
  "pricePer": 5.38,
  "price_case": 161.28,
  "price_each": 26.88,
  "price_order": 68,
  "price_unit": "lb",
  "relateds": [
    "106816",
    "111522",
    "112306",
    "106816",
    "111522",
    "112306",
    "106816",
    "111522"
  ],
  "showImage": "https://d3tlizm80tjdt4.cloudfront.net/remote_images/image/2650/small/8ccc10b43c0da13a2feaa26d6af00080d864418c35ce1b4439.jpg",
  "text": "Cheese, Parmesan, Shredded, (6) 5 Lb - 124603 is a shredded parmesan cheese made by the brand Galbani, belonging to the \"Shredded Cheese\" department. Each CASE includes 6 items, with each item weighing 0.833333 lbs and the total CASE weight being 5 lbs. The dimensions for both CASE and EACH unit are L 1\" x W 1\" x H 1\". The price is $161.28 per case and $26.88 for each item, with a price per pound of $5.38/lb. The product's SKU is 124603 and it is currently not available in the shop. There are multiple related products with SKUs 106816, 111522, and 112306. For more details, visit: https://shop.kimelo.com/sku/cheese-parmesan-shredded-6-5-lb-124603/124603.",
  "weight_case": 5,
  "weight_each": 0.833333,
  "weight_unit": "lbs"
},
{
  "_id": {
    "$oid": "681daac5de130bddf45fd0ae"
  },
  "sku": "123535",
  "brand": "Galbani",
  "count_unit": "Item",
  "department": "Cheese Loaf",
  "dimension_each": "L 1\" x W 1\" x H 1\"",
  "discount": "",
  "empty": true,
  "href": "https://shop.kimelo.com/sku/cheese-mozzarella-fresh-loaf-sliced-61-lb-123535/123535",
  "images": [
    "https://d3tlizm80tjdt4.cloudfront.net/remote_images/image/1088/small/e9d4570a644a2ae0665f696c669bff43b9d6ccd681d0ebc349.jpg"
  ],
  "item_counts_each": 1,
  "name": "Cheese, Mozzarella, Fresh, Loaf, Sliced, 6/1 Lb - 123535",
  "popularity_order": 24,
  "price": 38.68,
  "pricePer": 6.45,
  "price_each": 38.68,
  "price_order": 55,
  "price_unit": "lb",
  "relateds": [
    "123382",
    "112545"
  ],
  "showImage": "https://d3tlizm80tjdt4.cloudfront.net/remote_images/image/1088/small/e9d4570a644a2ae0665f696c669bff43b9d6ccd681d0ebc349.jpg",
  "text": "The \"Cheese, Mozzarella, Fresh, Loaf, Sliced, 6/1 Lb - 123535\" from Galbani is categorized under Cheese Loaf. Each unit contains 1 item, measuring L 1\" x W 1\" x H 1\", and weighs 6 lbs. The price for each is $38.68, which comes to $6.45 per pound. The SKU for this cheese is 123535, and it is currently not available in the shop. There are related cheeses with SKUs 123382 and 112545. The product ranks 55th in highest price order and 24th in popularity. You can view the cheese at https://shop.kimelo.com/sku/cheese-mozzarella-fresh-loaf-sliced-61-lb-123535/123535, and the preview image is available at https://d3tlizm80tjdt4.cloudfront.net/remote_images/image/1088/small/e9d4570a644a2ae0665f696c669bff43b9d6ccd681d0ebc349.jpg.",
  "weight_each": 6,
  "weight_unit": "lbs"
},
{
  "_id": {
    "$oid": "681daac6de130bddf45fd0af"
  },
  "sku": "112596",
  "brand": "El Mexicano",
  "count_unit": "Item",
  "department": "Specialty Cheese",
  "dimension_each": "L 1\" x W 1\" x H 1\"",
  "discount": "",
  "empty": false,
  "href": "https://shop.kimelo.com/sku/cheese-queso-fresco-casero-bulk-12-lbs-112596/112596",
  "images": [
    "https://d3tlizm80tjdt4.cloudfront.net/image/13392/image/sm-a1beb72594462199dfe813034c8f0f08.png"
  ],
  "item_counts_each": 1,
  "name": "Cheese, Queso Fresco, Casero, Bulk 12 Lbs - 112596",
  "popularity_order": 31,
  "price": 49.39,
  "pricePer": 4.12,
  "price_each": 49.39,
  "price_order": 44,
  "price_unit": "lb",
  "relateds": [],
  "showImage": "https://d3tlizm80tjdt4.cloudfront.net/image/13392/image/sm-a1beb72594462199dfe813034c8f0f08.png",
  "text": "Cheese, Queso Fresco, Casero, Bulk 12 Lbs (SKU: 112596) is a specialty cheese offered by El Mexicano. This cheese comes in a bulk size with each item weighing 12 pounds and has dimensions of L 1\" x W 1\" x H 1\". It is categorized under Specialty Cheese and is available for purchase at $49.39 per item, which equates to $4.12 per pound. There is currently no discount for this product, and it is in stock. The product image can be viewed at https://d3tlizm80tjdt4.cloudfront.net/image/13392/image/sm-a1beb72594462199dfe813034c8f0f08.png. There are no related cheeses listed for this SKU. For more details or to purchase, visit https://shop.kimelo.com/sku/cheese-queso-fresco-casero-bulk-12-lbs-112596/112596.",
  "weight_each": 12,
  "weight_unit": "lbs"
},
{
  "_id": {
    "$oid": "681daac6de130bddf45fd0b0"
  },
  "sku": "125732",
  "brand": "Galbani Premio",
  "count_unit": "Item",
  "department": "Specialty Cheese",
  "dimension_each": "L 1\" x W 1\" x H 1\"",
  "discount": "",
  "empty": true,
  "href": "https://shop.kimelo.com/sku/cheese-mozzarella-wmlm-premio-tigrato-shred-65lb-125732/125732",
  "images": [
    "https://d3tlizm80tjdt4.cloudfront.net/remote_images/image/7219/small/6c77b279a5ed42add9439bbdfc694637d60aaae4f2f0ec56d7.jpg"
  ],
  "item_counts_each": 1,
  "name": "Cheese, Mozzarella, Wmlm, Premio, Tigrato Shred, 6/5lb 125732",
  "popularity_order": 32,
  "price": 104.33,
  "pricePer": 3.48,
  "price_each": 104.33,
  "price_order": 15,
  "price_unit": "lb",
  "relateds": [],
  "showImage": "https://d3tlizm80tjdt4.cloudfront.net/remote_images/image/7219/small/6c77b279a5ed42add9439bbdfc694637d60aaae4f2f0ec56d7.jpg",
  "text": "Cheese, Mozzarella, Wmlm, Premio, Tigrato Shred, 6/5lb (SKU: 125732) is a specialty cheese produced by Galbani Premio. This item is classified under the Specialty Cheese department and is provided in a single unit, each with dimensions of L 1\" x W 1\" x H 1\" and a total weight of 30 lbs. The price for each unit is $104.33, with a price per pound of $3.48/lb. There are currently no discounts available and the product is marked as out of stock. No related products are listed for this SKU. For more details or to view the product image, visit: https://shop.kimelo.com/sku/cheese-mozzarella-wmlm-premio-tigrato-shred-65lb-125732/125732.",
  "weight_each": 30,
  "weight_unit": "lbs"
},
{
  "_id": {
    "$oid": "681daac6de130bddf45fd0b1"
  },
  "sku": "123792",
  "brand": "Galbani",
  "count_unit": "Item",
  "department": "Cheese Loaf",
  "dimension_case": "L 1\" x W 1\" x H 1\"",
  "dimension_each": "L 1\" x W 1\" x H 1\"",
  "discount": "",
  "empty": true,
  "href": "https://shop.kimelo.com/sku/cheese-provolone-no-smoke-professionale-8-5-lb-123792/123792",
  "images": [
    "https://d3tlizm80tjdt4.cloudfront.net/image/17989/image/sm-9e1c062d6e753907a3748fcfa2471be0.jpg"
  ],
  "item_counts_case": 8,
  "item_counts_each": 1,
  "name": "Cheese, Provolone, No Smoke, Professionale, (8) 5 Lb - 123792",
  "popularity_order": 33,
  "price": 14.4,
  "pricePer": 2.88,
  "price_case": 115.2,
  "price_each": 14.4,
  "price_order": 90,
  "price_unit": "lb",
  "relateds": [],
  "showImage": "https://d3tlizm80tjdt4.cloudfront.net/image/17989/image/sm-9e1c062d6e753907a3748fcfa2471be0.jpg",
  "text": "The \"Cheese, Provolone, No Smoke, Professionale, (8) 5 Lb - 123792\" is a provolone cheese loaf by Galbani, listed under the Cheese Loaf category. This cheese comes in a case of 8 eaches, with each item measuring approximately L 1\" x W 1\" x H 1\", and each unit weighs 0.625 lbs while the case weighs 5 lbs. The price is $14.40 per each or $115.20 per case, with a price-per-pound of $2.88. The product's SKU is 123792, and it is currently marked as unavailable in the shop. No discounts are offered at this time, and there are no related products listed. For more details, you can visit the product page at https://shop.kimelo.com/sku/cheese-provolone-no-smoke-professionale-8-5-lb-123792/123792.",
  "weight_case": 5,
  "weight_each": 0.625,
  "weight_unit": "lbs"
},
{
  "_id": {
    "$oid": "681daac7de130bddf45fd0b2"
  },
  "sku": "123928",
  "brand": "Cucina",
  "count_unit": "Item",
  "department": "Specialty Cheese",
  "dimension_each": "L 1\" x W 1\" x H 1\"",
  "discount": "",
  "empty": true,
  "href": "https://shop.kimelo.com/sku/cheese-feta-in-brine-pail-28-lb-123928/123928",
  "images": [
    "https://d3tlizm80tjdt4.cloudfront.net/image/18031/image/sm-4300f3a70bfa2261c03c2ddc7f7fa85b.jpg"
  ],
  "item_counts_each": 1,
  "name": "Cheese, Feta, In Brine, Pail, 28 Lb - 123928",
  "popularity_order": 39,
  "price": 145.11,
  "pricePer": 6.05,
  "price_each": 145.11,
  "price_order": 5,
  "price_unit": "lb",
  "relateds": [
    "123797",
    "124284"
  ],
  "showImage": "https://d3tlizm80tjdt4.cloudfront.net/image/18031/image/sm-4300f3a70bfa2261c03c2ddc7f7fa85b.jpg",
  "text": "Cheese, Feta, In Brine, Pail, 28 Lb (SKU: 123928) is a specialty cheese from the brand Cucina, presented in a 28-pound pail with each unit measuring L 1\" x W 1\" x H 1\". The price for each pail is $145.11, with a cost of $6.05 per pound. This cheese falls under the Specialty Cheese department and is currently unavailable for purchase. The main image for this feta cheese can be found at https://d3tlizm80tjdt4.cloudfront.net/image/18031/image/sm-4300f3a70bfa2261c03c2ddc7f7fa85b.jpg. Related cheeses have SKUs 123797 and 124284. It ranks 5th in price order and 39th in popularity order among similar items. More details are available at https://shop.kimelo.com/sku/cheese-feta-in-brine-pail-28-lb-123928/123928.",
  "weight_each": 28,
  "weight_unit": "lbs"
},
{
  "_id": {
    "$oid": "681daac7de130bddf45fd0b3"
  },
  "sku": "123527",
  "brand": "President",
  "count_unit": "Item",
  "department": "Specialty Cheese",
  "dimension_each": "L 1\" x W 1\" x H 1\"",
  "discount": "",
  "empty": true,
  "href": "https://shop.kimelo.com/sku/cheese-brie-60-22-lb-123527/123527",
  "images": [
    "https://d3tlizm80tjdt4.cloudfront.net/remote_images/image/1073/small/b1d9e1f95c8820a32503eaeb15b2209c65268ad5e29a3f395c.jpg"
  ],
  "item_counts_each": 1,
  "name": "Cheese, Brie, 60%, 2/2 Lb - 123527",
  "popularity_order": 49,
  "price": 29.1,
  "pricePer": 7.28,
  "price_each": 29.1,
  "price_order": 67,
  "price_unit": "lb",
  "relateds": [],
  "showImage": "https://d3tlizm80tjdt4.cloudfront.net/remote_images/image/1073/small/b1d9e1f95c8820a32503eaeb15b2209c65268ad5e29a3f395c.jpg",
  "text": "Cheese, Brie, 60%, 2/2 Lb - 123527 is a specialty cheese from the brand President. It is categorized under Specialty Cheese and comes as one item per unit, with each unit weighing 4 lbs and measuring L 1\" x W 1\" x H 1\". The price per item is $29.10, with a rate of $7.28 per pound, and there is currently no discount available. The cheese can be previewed using this image: https://d3tlizm80tjdt4.cloudfront.net/remote_images/image/1073/small/b1d9e1f95c8820a32503eaeb15b2209c65268ad5e29a3f395c.jpg. There are no related cheeses listed for this SKU, which is 123527. This product is currently not available in the shop, and its detailed page can be found at https://shop.kimelo.com/sku/cheese-brie-60-22-lb-123527/123527. In the shop, it ranks 67th in Price Highest First and 49th in Popularity.",
  "weight_each": 4,
  "weight_unit": "lbs"
},
{
  "_id": {
    "$oid": "681daac7de130bddf45fd0b4"
  },
  "sku": "103593",
  "brand": "Galbani",
  "count_unit": "Item",
  "department": "Specialty Cheese",
  "dimension_case": "L 1\" x W 1\" x H 1\"",
  "dimension_each": "L 1\" x W 1\" x H 1\"",
  "discount": "",
  "empty": true,
  "href": "https://shop.kimelo.com/sku/cheese-mozzarella-fresh-ciliegine-ball-2-3-lb-103593/103593",
  "images": [
    "https://d3tlizm80tjdt4.cloudfront.net/image/2895/image/sm-39fab4880cecbec356527056a05d3a44.jpg",
    "https://d3tlizm80tjdt4.cloudfront.net/image/2896/image/sm-dd03d82250538609a7f34030a50e240b.jpg"
  ],
  "item_counts_case": 2,
  "item_counts_each": 1,
  "name": "Cheese, Mozzarella, Fresh, Ciliegine Ball, (2) 3 Lb 103593",
  "popularity_order": 53,
  "price": 17.44,
  "pricePer": 5.81,
  "price_case": 34.88,
  "price_each": 17.44,
  "price_order": 80,
  "price_unit": "lb",
  "relateds": [
    "123382"
  ],
  "showImage": "https://d3tlizm80tjdt4.cloudfront.net/image/2896/image/sm-dd03d82250538609a7f34030a50e240b.jpg",
  "text": "Cheese, Mozzarella, Fresh, Ciliegine Ball (sku 103593) is a specialty cheese from the brand Galbani. It is available as a case containing 2 items, each weighing 1.5 lbs, for a total case weight of 3 lbs. The dimensions for both the case and each item are L 1\" x W 1\" x H 1\". The price is $17.44 for each item and $34.88 per case, with a price per pound of $5.81. Preview and reference images are available, and there is a related cheese with SKU 123382. Currently, this cheese is out of stock. For more details and purchasing, visit https://shop.kimelo.com/sku/cheese-mozzarella-fresh-ciliegine-ball-2-3-lb-103593/103593.",
  "weight_case": 3,
  "weight_each": 1.5,
  "weight_unit": "lbs"
},
{
  "_id": {
    "$oid": "681daac8de130bddf45fd0b5"
  },
  "sku": "124017",
  "brand": "Yanni",
  "count_unit": "Item",
  "department": "Sliced Cheese",
  "dimension_each": "L 1\" x W 1\" x H 1\"",
  "discount": "",
  "empty": true,
  "href": "https://shop.kimelo.com/sku/cheese-grilling-domestic-yanni-128-oz-124017/124017",
  "images": [
    "https://d3tlizm80tjdt4.cloudfront.net/remote_images/image/1898/small/d052d2826fa65f597dbb4441da172a9957dee2a899142d1940.jpg"
  ],
  "item_counts_each": 1,
  "name": "Cheese, Grilling, Domestic, Yanni, 12/8 Oz 124017",
  "popularity_order": 56,
  "price": 48.44,
  "pricePer": 8.07,
  "price_each": 48.44,
  "price_order": 46,
  "price_unit": "lb",
  "relateds": [],
  "showImage": "https://d3tlizm80tjdt4.cloudfront.net/remote_images/image/1898/small/d052d2826fa65f597dbb4441da172a9957dee2a899142d1940.jpg",
  "text": "Cheese, Grilling, Domestic, Yanni, 12/8 Oz (SKU: 124017) is a sliced cheese product from the Yanni brand, categorized under Sliced Cheese. Each unit consists of 1 item with a weight of 6 lbs and dimensions of L 1\" x W 1\" x H 1\". The price for each unit is $48.44, which equals $8.07 per pound. The product currently has no discount offers and is marked as unavailable at the shop. There are no related cheese SKUs associated with this item. You can view more details or images at the provided link: https://shop.kimelo.com/sku/cheese-grilling-domestic-yanni-128-oz-124017/124017. This cheese holds a price order ranking of 46 and a popularity order of 56 among other cheeses.",
  "weight_each": 6,
  "weight_unit": "lbs"
},
{
  "_id": {
    "$oid": "681daac8de130bddf45fd0b6"
  },
  "sku": "124640",
  "brand": "Stymfalia",
  "count_unit": "Item",
  "department": "Sliced Cheese",
  "dimension_each": "L 13.5\" x W 9.25\" x H 8.25\"",
  "discount": "",
  "empty": true,
  "href": "https://shop.kimelo.com/sku/cheese-myzithra-ball-imported/124640",
  "images": [
    "https://d3tlizm80tjdt4.cloudfront.net/remote_images/image/2633/small/a61a9af8858203a8085b3cd5314e44f2375da6387dd3b0ab73.jpg"
  ],
  "item_counts_each": 1,
  "name": "Cheese, Myzithra, Ball, Imported",
  "popularity_order": 61,
  "price": 79.05,
  "pricePer": 5.07,
  "price_each": 79.05,
  "price_order": 27,
  "price_unit": "lb",
  "relateds": [
    "108978"
  ],
  "showImage": "https://d3tlizm80tjdt4.cloudfront.net/remote_images/image/2633/small/a61a9af8858203a8085b3cd5314e44f2375da6387dd3b0ab73.jpg",
  "text": "Cheese, Myzithra, Ball, Imported by Stymfalia is categorized as sliced cheese and comes in a single item per purchase. Each ball has dimensions of 13.5 inches in length, 9.25 inches in width, and 8.25 inches in height, with a total weight of 17 lbs. The price for each is $79.05, making the cost $5.07 per pound. Its SKU is 124640 and it is currently marked as unavailable in the shop. You can view more details and a preview image at the provided link: https://shop.kimelo.com/sku/cheese-myzithra-ball-imported/124640. The cheese has one related product with SKU 108978. It ranks 27th in price and 61st in popularity among cheeses in the store.",
  "weight_each": 17,
  "weight_unit": "lbs"
},
{
  "_id": {
    "$oid": "681daac9de130bddf45fd0b7"
  },
  "sku": "374274",
  "brand": "El Mexicano",
  "count_unit": "Item",
  "department": "Specialty Cheese",
  "dimension_each": "L 1\" x W 1\" x H 1\"",
  "discount": "",
  "empty": true,
  "href": "https://shop.kimelo.com/sku/cheese-queso-fresco-casero-frozen-bulk-12-lbs374274/374274",
  "images": [
    "https://d3tlizm80tjdt4.cloudfront.net/remote_images/image/8643/small/66078553f3b39103164ffde635b3f3f92e35c6e0786f8709da.jpg"
  ],
  "item_counts_each": 1,
  "name": "Cheese, Queso Fresco, Casero, Frozen, Bulk 12 Lbs374274",
  "popularity_order": 70,
  "price": 21.19,
  "pricePer": 1.77,
  "price_each": 21.19,
  "price_order": 73,
  "price_unit": "Lb",
  "relateds": [],
  "showImage": "https://d3tlizm80tjdt4.cloudfront.net/remote_images/image/8643/small/66078553f3b39103164ffde635b3f3f92e35c6e0786f8709da.jpg",
  "text": "Cheese, Queso Fresco, Casero, Frozen, Bulk 12 Lbs is a specialty cheese by El Mexicano. This product is sold as one unit weighing 12 lbs, with dimensions of L 1\" x W 1\" x H 1\" per item. It is currently marked as out of stock. The price per unit is $21.19, with a cost of $1.77 per pound. The cheese’s SKU is 374274 and it ranks 73rd in price order and 70th in popularity. There are no related products or available discounts for this item. For more details, you can view the product at https://shop.kimelo.com/sku/cheese-queso-fresco-casero-frozen-bulk-12-lbs374274/374274.",
  "weight_each": 12,
  "weight_unit": "lbs"
},
{
  "_id": {
    "$oid": "681daac9de130bddf45fd0b8"
  },
  "sku": "123993",
  "brand": "Stella",
  "count_unit": "Item",
  "department": "Sliced Cheese",
  "dimension_each": "L 1\" x W 1\" x H 1\"",
  "discount": "",
  "empty": true,
  "href": "https://shop.kimelo.com/sku/cheese-kasseri-waxed-wheel/123993",
  "images": [
    "https://d3tlizm80tjdt4.cloudfront.net/remote_images/image/2037/small/93701c5bb1e6a23ddfdd86fb5e4e8868e9496d4ff700d601e0.jpg"
  ],
  "item_counts_each": 1,
  "name": "Cheese, Kasseri, Waxed Wheel",
  "popularity_order": 71,
  "price": 86.8,
  "pricePer": 8.68,
  "price_each": 86.8,
  "price_order": 24,
  "price_unit": "lb",
  "relateds": [],
  "showImage": "https://d3tlizm80tjdt4.cloudfront.net/remote_images/image/2037/small/93701c5bb1e6a23ddfdd86fb5e4e8868e9496d4ff700d601e0.jpg",
  "text": "Cheese, Kasseri, Waxed Wheel is a specialty sliced cheese from the brand Stella. It is available as a single item per unit, with each unit measuring 1 inch by 1 inch by 1 inch and weighing 10 lbs. The price for each cheese wheel is $86.80, which corresponds to $8.68 per pound. The SKU for this product is 123993 and it currently has no discounts available. The cheese is currently not in stock at the shop. It is listed as number 24 in highest price order and 71st in popularity rank. For more information, you can visit the product page at https://shop.kimelo.com/sku/cheese-kasseri-waxed-wheel/123993.",
  "weight_each": 10,
  "weight_unit": "lbs"
},
{
  "_id": {
    "$oid": "681daac9de130bddf45fd0ba"
  },
  "sku": "374591",
  "brand": "Gossner",
  "count_unit": "Item",
  "department": "Sliced Cheese",
  "dimension_each": "L 1\" x W 1\" x H 1\"",
  "discount": "",
  "empty": true,
  "href": "https://shop.kimelo.com/sku/cheese-smoked-cheddar-mild-25-lb/374591",
  "images": [
    "https://d3tlizm80tjdt4.cloudfront.net/remote_images/image/13375/small/2ee6dfdf5b22cc7c7a84d4a5acf73506e8fcb5effe8cea044c.jpg"
  ],
  "item_counts_each": 1,
  "name": "Cheese, Smoked Cheddar, Mild, 2/5 Lb",
  "popularity_order": 76,
  "price": 3.21,
  "pricePer": 0.32,
  "price_each": 3.21,
  "price_order": 98,
  "price_unit": "Lb",
  "relateds": [],
  "showImage": "https://d3tlizm80tjdt4.cloudfront.net/remote_images/image/13375/small/2ee6dfdf5b22cc7c7a84d4a5acf73506e8fcb5effe8cea044c.jpg",
  "text": "Cheese, Smoked Cheddar, Mild, 2/5 Lb is a mild smoked cheddar cheese offered by the Gossner brand in the Sliced Cheese department. Each unit consists of 1 item with dimensions of L 1\" x W 1\" x H 1\" and a total weight of 10 lbs. The cheese is priced at $3.21 per item, with a cost of $0.32 per pound, and there are currently no available discounts. The stock keeping unit (SKU) for this cheese is 374591, and it ranks 98th by price order and 76th by popularity order. No related cheeses are listed for this item. This particular cheese is currently not available in the shop. For more details or to view its image, visit https://shop.kimelo.com/sku/cheese-smoked-cheddar-mild-25-lb/374591.",
  "weight_each": 10,
  "weight_unit": "lbs"
},
{
  "_id": {
    "$oid": "681daacade130bddf45fd0bb"
  },
  "sku": "103565",
  "brand": "POLLY-O",
  "count_unit": "Item",
  "department": "Specialty Cheese",
  "dimension_case": "L 8.57\" x W 4.45\" x H 13.89\"",
  "dimension_each": "L 4.29\" x W 4.45\" x H 13.89\"",
  "discount": "",
  "empty": true,
  "href": "https://shop.kimelo.com/sku/cheese-mozzarella-smoked-26-lb/103565",
  "images": [
    "https://d3tlizm80tjdt4.cloudfront.net/image/2351/image/sm-8f112e2ad6cf67b95091b3a5cffad334.png",
    "https://d3tlizm80tjdt4.cloudfront.net/image/2352/image/sm-fda12b50b5a30094ede90f0f660bce7e.jpg"
  ],
  "item_counts_case": 2,
  "item_counts_each": 1,
  "name": "CHEESE, MOZZARELLA, SMOKED, 2/6 LB",
  "popularity_order": 79,
  "price": 43.56,
  "pricePer": 0,
  "price_case": 85.15,
  "price_each": 43.56,
  "price_order": 51,
  "price_unit": "lb",
  "relateds": [],
  "showImage": "https://d3tlizm80tjdt4.cloudfront.net/image/2351/image/sm-8f112e2ad6cf67b95091b3a5cffad334.png",
  "text": "CHEESE, MOZZARELLA, SMOKED, 2/6 LB is a specialty cheese from the brand POLLY-O. It is sold in cases containing 2 items, each item weighing 6 lbs, for a total case weight of 11.73 lbs. The dimensions of each item are L 4.29\" x W 4.45\" x H 13.89\", while the case dimensions are L 8.57\" x W 4.45\" x H 13.89\". The price is $43.56 per item and $85.15 per case, with a price per pound listed as $0/lb. The SKU for this product is 103565, and currently this item is marked as unavailable in the shop. The cheese is ranked 51st in price order and 79th in popularity order. For more information or images, visit the product page at https://shop.kimelo.com/sku/cheese-mozzarella-smoked-26-lb/103565.",
  "weight_case": 11.73,
  "weight_each": 6,
  "weight_unit": "lbs"
},
{
  "_id": {
    "$oid": "681daacade130bddf45fd0bc"
  },
  "sku": "126018",
  "brand": "Ammerlander",
  "count_unit": "Item",
  "department": "Sliced Cheese",
  "dimension_each": "L 19.5\" x W 11.7\" x H 3.9\"",
  "discount": "",
  "empty": true,
  "href": "https://shop.kimelo.com/sku/cheese-swiss-block/126018",
  "images": [
    "https://d3tlizm80tjdt4.cloudfront.net/remote_images/image/7811/small/6cc605766939ddd78229cbfac6a2103b6982de8f053c875d63.jpg"
  ],
  "item_counts_each": 1,
  "name": "Cheese, Swiss, Block",
  "popularity_order": 80,
  "price": 108.9,
  "pricePer": 3.3,
  "price_each": 108.9,
  "price_order": 12,
  "price_unit": "lb",
  "relateds": [],
  "showImage": "https://d3tlizm80tjdt4.cloudfront.net/remote_images/image/7811/small/6cc605766939ddd78229cbfac6a2103b6982de8f053c875d63.jpg",
  "text": "Cheese, Swiss, Block is offered by the brand Ammerlander and categorized under Sliced Cheese. Each unit consists of one item with dimensions of 19.5 inches long, 11.7 inches wide, and 3.9 inches high, weighing 33 pounds. The price for each block is $108.90, with a price per pound of $3.30. The SKU for this cheese is 126018, and the product currently has no available stock in the shop. There are no related cheese products listed for this SKU, and no discounts are currently offered. For more information, you can visit the product page at https://shop.kimelo.com/sku/cheese-swiss-block/126018, and a preview image is available at the provided image link.",
  "weight_each": 33,
  "weight_unit": "lbs"
},
{
  "_id": {
    "$oid": "681daacade130bddf45fd0bd"
  },
  "sku": "374160",
  "brand": "Galbani",
  "count_unit": "Item",
  "department": "Shredded Cheese",
  "dimension_each": "L 1\" x W 1\" x H 1\"",
  "discount": "",
  "empty": true,
  "href": "https://shop.kimelo.com/sku/cheese-5-blend-moz-wmlmlmpsprovparmroma-fzn-65-lb/374160",
  "images": [
    "https://d3tlizm80tjdt4.cloudfront.net/remote_images/image/8017/small/5b67c48b8fb317538fe7a3777c8aa936e15d7ed4f7f4c2062d.jpg"
  ],
  "item_counts_each": 1,
  "name": "Cheese, 5 Blend, Moz Wmlm/lmps/prov/parm/roma, Fzn, 6/5 Lb",
  "popularity_order": 81,
  "price": 80.07,
  "pricePer": 0,
  "price_each": 80.07,
  "price_order": 26,
  "price_unit": "lb",
  "relateds": [],
  "showImage": "https://d3tlizm80tjdt4.cloudfront.net/remote_images/image/8017/small/5b67c48b8fb317538fe7a3777c8aa936e15d7ed4f7f4c2062d.jpg",
  "text": "The cheese \"Cheese, 5 Blend, Moz Wmlm/lmps/prov/parm/roma, Fzn, 6/5 Lb\" is produced by the brand Galbani and categorized under Shredded Cheese. This product consists of a five-cheese blend, including mozzarella (Wmlm/lmps), provolone, parmesan, and romano, and is sold frozen. Each unit contains 1 item with dimensions of L 1\" x W 1\" x H 1\" and a total weight of 30 lbs. The price per unit is $80.07, with a listed price per pound of $0/lb. Its SKU is 374160. There are currently no available related products. This cheese is marked as unavailable at the shop. The product ranks 26th in price order and 81st in popularity. More details and an image can be found at https://shop.kimelo.com/sku/cheese-5-blend-moz-wmlmlmpsprovparmroma-fzn-65-lb/374160.",
  "weight_each": 30,
  "weight_unit": "lbs"
},
{
  "_id": {
    "$oid": "681daacbde130bddf45fd0be"
  },
  "sku": "316282",
  "brand": "Clover Sonoma",
  "count_unit": "Item",
  "department": "Cottage Cheese",
  "dimension_each": "L 1\" x W 1\" x H 1\"",
  "discount": "",
  "empty": true,
  "href": "https://shop.kimelo.com/sku/cottage-cheese-small-curd/316282",
  "images": [
    "https://d3tlizm80tjdt4.cloudfront.net/remote_images/image/8670/small/14def803c1c34fe56ec8c8333ba02a43ed6690f593186e7f98.jpg"
  ],
  "item_counts_each": 1,
  "name": "Cottage Cheese, Small Curd",
  "popularity_order": 82,
  "price": 39.93,
  "pricePer": 3.33,
  "price_each": 39.93,
  "price_order": 53,
  "price_unit": "Lb",
  "relateds": [],
  "showImage": "https://d3tlizm80tjdt4.cloudfront.net/remote_images/image/8670/small/14def803c1c34fe56ec8c8333ba02a43ed6690f593186e7f98.jpg",
  "text": "Cottage Cheese, Small Curd by Clover Sonoma is categorized under Cottage Cheese. Each item has a weight of 12 lbs and dimensions of L 1\" x W 1\" x H 1\". The price for each unit is $39.93, which comes to $3.33 per pound. There are no available discounts for this product at the moment. The SKU is 316282 and there are currently no related cheeses listed. This cheese ranks 53rd in price and 82nd in popularity. It is currently unavailable at the shop, and further details can be found at https://shop.kimelo.com/sku/cottage-cheese-small-curd/316282.",
  "weight_each": 12,
  "weight_unit": "lbs"
},
{
  "_id": {
    "$oid": "681daacbde130bddf45fd0bf"
  },
  "sku": "125813",
  "brand": "Galbani Premio",
  "count_unit": "Item",
  "department": "Cheese Loaf",
  "dimension_each": "L 1\" x W 1\" x H 1\"",
  "discount": "",
  "empty": true,
  "href": "https://shop.kimelo.com/sku/cheese-mozzarella-pslm-loaf-premio-fzn-85-lb-125813/125813",
  "images": [
    "https://d3tlizm80tjdt4.cloudfront.net/remote_images/image/7216/small/71b5ddd3c64d4bbaa1fe5e7090917a824d29a331ea6e1ee5d4.jpg"
  ],
  "item_counts_each": 1,
  "name": "Cheese, Mozzarella, Pslm, Loaf, Premio, Fzn, 8/5 Lb 125813",
  "popularity_order": 83,
  "price": 50.22,
  "pricePer": 1.26,
  "price_each": 50.22,
  "price_order": 42,
  "price_unit": "lb",
  "relateds": [],
  "showImage": "https://d3tlizm80tjdt4.cloudfront.net/remote_images/image/7216/small/71b5ddd3c64d4bbaa1fe5e7090917a824d29a331ea6e1ee5d4.jpg",
  "text": "Cheese, Mozzarella, Pslm, Loaf, Premio, Fzn, 8/5 Lb (SKU: 125813) is produced by the brand Galbani Premio and belongs to the Cheese Loaf department. Each unit consists of 1 item, with dimensions of L 1\" x W 1\" x H 1\" and a total weight of 40 lbs. The price for each is $50.22, which translates to $1.26 per pound. There are no available discounts for this product, and currently, it is out of stock. There are no related cheeses listed for this item. You can view the product image at https://d3tlizm80tjdt4.cloudfront.net/remote_images/image/7216/small/71b5ddd3c64d4bbaa1fe5e7090917a824d29a331ea6e1ee5d4.jpg and find more details at https://shop.kimelo.com/sku/cheese-mozzarella-pslm-loaf-premio-fzn-85-lb-125813/125813. In terms of pricing, it ranks 42nd, and its popularity is ranked at 83rd.",
  "weight_each": 40,
  "weight_unit": "lbs"
},
{
  "_id": {
    "$oid": "681daaccde130bddf45fd0c0"
  },
  "sku": "125885",
  "brand": "President",
  "count_unit": "Item",
  "department": "Specialty Cheese",
  "dimension_each": "L 1\" x W 1\" x H 1\"",
  "discount": "",
  "empty": true,
  "href": "https://shop.kimelo.com/sku/cheese-goat-crumbled-fzn-22-lb-125885/125885",
  "images": [
    "https://d3tlizm80tjdt4.cloudfront.net/remote_images/image/7510/small/677b2a41544b3dfe7f0897e9390fcccfad1cbaae841b2ceb87.jpg"
  ],
  "item_counts_each": 1,
  "name": "Cheese, Goat, Crumbled, Fzn, 2/2 Lb 125885",
  "popularity_order": 84,
  "price": 34.41,
  "pricePer": 8.6,
  "price_each": 34.41,
  "price_order": 59,
  "price_unit": "lb",
  "relateds": [],
  "showImage": "https://d3tlizm80tjdt4.cloudfront.net/remote_images/image/7510/small/677b2a41544b3dfe7f0897e9390fcccfad1cbaae841b2ceb87.jpg",
  "text": "Cheese, Goat, Crumbled, Fzn, 2/2 Lb (SKU: 125885) is a specialty cheese from the brand President. It comes in a single item with a total weight of 4 lbs and the dimensions are L 1\" x W 1\" x H 1\" per item. The cheese is sold at a price of $34.41 each, with a price per pound of $8.60. There are currently no discounts available for this cheese. This product is listed as out of stock at the shop. You can view an image of the cheese at the provided link and access more details through https://shop.kimelo.com/sku/cheese-goat-crumbled-fzn-22-lb-125885/125885. There are no related cheeses associated with this SKU, and it ranks 59th by price and 84th by popularity.",
  "weight_each": 4,
  "weight_unit": "lbs"
},
{
  "_id": {
    "$oid": "681daaccde130bddf45fd0c1"
  },
  "sku": "125867",
  "brand": "Packer",
  "count_unit": "Item",
  "department": "Specialty Cheese",
  "dimension_each": "L 1\" x W 1\" x H 1\"",
  "discount": "",
  "empty": true,
  "href": "https://shop.kimelo.com/sku/cheese-mozzarella-wmlm-premio-tigrato-shred-fzn-65lb-125867/125867",
  "images": [
    "https://d3tlizm80tjdt4.cloudfront.net/remote_images/image/7219/small/6c77b279a5ed42add9439bbdfc694637d60aaae4f2f0ec56d7.jpg"
  ],
  "item_counts_each": 1,
  "name": "Cheese, Mozzarella, Wmlm, Premio, Tigrato Shred, Fzn, 6/5lb 125867",
  "popularity_order": 85,
  "price": 106.17,
  "pricePer": 3.54,
  "price_each": 106.17,
  "price_order": 14,
  "price_unit": "lb",
  "relateds": [],
  "showImage": "https://d3tlizm80tjdt4.cloudfront.net/remote_images/image/7219/small/6c77b279a5ed42add9439bbdfc694637d60aaae4f2f0ec56d7.jpg",
  "text": "Cheese, Mozzarella, Wmlm, Premio, Tigrato Shred, Fzn, 6/5lb (SKU: 125867) is a specialty cheese produced by the brand Packer. This mozzarella cheese is offered in a shredded, frozen form and each unit contains 1 item with a total weight of 30 lbs and dimensions of L 1\" x W 1\" x H 1\". The price per unit is $106.17, which breaks down to $3.54 per pound. There are no current discounts available for this cheese. At the moment, this product is not available in the shop. It is ranked 14th by price and 85th by popularity. More information and a preview image can be found at https://shop.kimelo.com/sku/cheese-mozzarella-wmlm-premio-tigrato-shred-fzn-65lb-125867/125867.",
  "weight_each": 30,
  "weight_unit": "lbs"
},
{
  "_id": {
    "$oid": "681daacdde130bddf45fd0c2"
  },
  "sku": "125663",
  "brand": "Galbani",
  "count_unit": "Item",
  "department": "Specialty Cheese",
  "dimension_each": "L 1\" x W 1\" x H 1\"",
  "discount": "",
  "empty": true,
  "href": "https://shop.kimelo.com/sku/cheese-mozzarella-wmlm-shredded-red-label-fzn-65-lb-125663/125663",
  "images": [
    "https://d3tlizm80tjdt4.cloudfront.net/remote_images/image/5529/small/042d7c08627c19fc643914fdd06ade7ade98df11a63c15f672.jpg"
  ],
  "item_counts_each": 1,
  "name": "Cheese, Mozzarella, Wmlm, Shredded, Red Label, Fzn, 6/5 Lb 125663",
  "popularity_order": 86,
  "price": 65.57,
  "pricePer": 0,
  "price_each": 65.57,
  "price_order": 36,
  "price_unit": "lb",
  "relateds": [],
  "showImage": "https://d3tlizm80tjdt4.cloudfront.net/remote_images/image/5529/small/042d7c08627c19fc643914fdd06ade7ade98df11a63c15f672.jpg",
  "text": "Cheese, Mozzarella, Wmlm, Shredded, Red Label, Fzn, 6/5 Lb (SKU: 125663) is a specialty cheese product from the brand Galbani. It is categorized under Specialty Cheese and comes in a 30 lb package, with each unit measuring L 1\" x W 1\" x H 1\". The cheese is sold per item, and the price for each is $65.57, with the current price per pound listed as $0/lb. There are no related cheese products listed for this SKU, and there are no discounts available. The product is currently not available in the shop (empty: true). For more details, the product can be viewed at [this link](https://shop.kimelo.com/sku/cheese-mozzarella-wmlm-shredded-red-label-fzn-65-lb-125663/125663).",
  "weight_each": 30,
  "weight_unit": "lbs"
},
{
  "_id": {
    "$oid": "681daacdde130bddf45fd0c3"
  },
  "sku": "125816",
  "brand": "Galbani",
  "count_unit": "Item",
  "department": "Cheese Loaf",
  "dimension_case": "L 1\" x W 1\" x H 1\"",
  "dimension_each": "L 1\" x W 1\" x H 1\"",
  "discount": "",
  "empty": true,
  "href": "https://shop.kimelo.com/sku/cheese-provolone-no-smoke-professionale-fzn-8-5-lb-125816/125816",
  "images": [
    "https://d3tlizm80tjdt4.cloudfront.net/remote_images/image/7413/small/e7ae16a6c8dcf1eef4a92b9f6335615d4fb06ed12485f45e86.jpg"
  ],
  "item_counts_case": 8,
  "item_counts_each": 1,
  "name": "Cheese, Provolone, No Smoke, Professionale, Fzn, (8) 5 Lb 125816",
  "popularity_order": 87,
  "price": 16.63,
  "pricePer": 3.33,
  "price_case": 133.04,
  "price_each": 16.63,
  "price_order": 84,
  "price_unit": "lb",
  "relateds": [],
  "showImage": "https://d3tlizm80tjdt4.cloudfront.net/remote_images/image/7413/small/e7ae16a6c8dcf1eef4a92b9f6335615d4fb06ed12485f45e86.jpg",
  "text": "Cheese, Provolone, No Smoke, Professionale, Fzn, (8) 5 Lb (SKU: 125816) is a cheese loaf from the Galbani brand, categorized under Cheese Loaf. It is sold in cases containing 8 individual items, with each item weighing 0.625 lbs and each case weighing 5 lbs. The dimensions for both case and each item are L 1\" x W 1\" x H 1\". The price is $16.63 per item and $133.04 per case, with a price per pound of $3.33/lb. There are no related items or discounts currently available. This cheese is marked as out of stock. For more information or to view an image, visit https://shop.kimelo.com/sku/cheese-provolone-no-smoke-professionale-fzn-8-5-lb-125816/125816.",
  "weight_case": 5,
  "weight_each": 0.625,
  "weight_unit": "lbs"
},
{
  "_id": {
    "$oid": "681daacede130bddf45fd0c4"
  },
  "sku": "125856",
  "brand": "Galbani Premio",
  "count_unit": "Item",
  "department": "Specialty Cheese",
  "dimension_each": "L 1\" x W 1\" x H 1\"",
  "discount": "",
  "empty": true,
  "href": "https://shop.kimelo.com/sku/cheese-blend-mozz-wm-ps-premio-shred-fzn-65-lb-125856/125856",
  "images": [
    "https://d3tlizm80tjdt4.cloudfront.net/remote_images/image/7459/small/8d2ee5b0efabab48d9ab265bcbc2e0e8f2e2d463f70a584707.jpg"
  ],
  "item_counts_each": 1,
  "name": "Cheese, Blend, Mozz, Wm & Ps, Premio Shred, Fzn, 6/5 Lb 125856",
  "popularity_order": 88,
  "price": 48.61,
  "pricePer": 1.62,
  "price_each": 48.61,
  "price_order": 45,
  "price_unit": "lb",
  "relateds": [],
  "showImage": "https://d3tlizm80tjdt4.cloudfront.net/remote_images/image/7459/small/8d2ee5b0efabab48d9ab265bcbc2e0e8f2e2d463f70a584707.jpg",
  "text": "The \"Cheese, Blend, Mozz, Wm & Ps, Premio Shred, Fzn, 6/5 Lb 125856\" is a specialty cheese from the brand Galbani Premio. It is a blend of mozzarella cheese, packaged shredded and frozen, with each unit weighing 30 lbs and measuring L 1\" x W 1\" x H 1\". The price for each unit is $48.61, making the cost $1.62 per pound. This cheese falls under the \"Specialty Cheese\" department, and the SKU for this product is 125856. Currently, this cheese is not available in the shop. There are no related cheese SKUs or discounts provided. You can find more details at the product link: https://shop.kimelo.com/sku/cheese-blend-mozz-wm-ps-premio-shred-fzn-65-lb-125856/125856.",
  "weight_each": 30,
  "weight_unit": "lbs"
},
{
  "_id": {
    "$oid": "681daacede130bddf45fd0c5"
  },
  "sku": "125814",
  "brand": "Galbani",
  "count_unit": "Item",
  "department": "Cheese Loaf",
  "dimension_each": "L 1\" x W 1\" x H 1\"",
  "discount": "",
  "empty": true,
  "href": "https://shop.kimelo.com/sku/cheese-mozzarella-wmlm-loaf-professionale-fzn-85-lb-125814/125814",
  "images": [
    "https://d3tlizm80tjdt4.cloudfront.net/remote_images/image/7215/small/0a7da17fd94fe5c52868137e402c2fb20947dba2f4b452a049.jpg",
    "https://d3tlizm80tjdt4.cloudfront.net/remote_images/image/7220/small/564febd6c57bd79ec472a4abbba4d7f30ee5c39fc81e9005a2.jpg"
  ],
  "item_counts_each": 1,
  "name": "Cheese, Mozzarella, Wmlm, Loaf, Professionale, Fzn, 8/5 Lb 125814",
  "popularity_order": 89,
  "price": 44.63,
  "pricePer": 1.12,
  "price_each": 44.63,
  "price_order": 49,
  "price_unit": "lb",
  "relateds": [],
  "showImage": "https://d3tlizm80tjdt4.cloudfront.net/remote_images/image/7215/small/0a7da17fd94fe5c52868137e402c2fb20947dba2f4b452a049.jpg",
  "text": "Cheese, Mozzarella, Wmlm, Loaf, Professionale, Fzn, 8/5 Lb (SKU: 125814) is a specialty cheese loaf offered by the brand Galbani. This product falls under the Cheese Loaf department. Each unit consists of 1 item with dimensions of L 1\" x W 1\" x H 1\" and a total weight of 40 lbs. The price for each loaf is $44.63, making the price per pound $1.12. There is currently no available discount, and the cheese is marked as out of stock. Reference images can be found at the provided URLs. For more details, you can visit the product page at https://shop.kimelo.com/sku/cheese-mozzarella-wmlm-loaf-professionale-fzn-85-lb-125814/125814.",
  "weight_each": 40,
  "weight_unit": "lbs"
},
{
  "_id": {
    "$oid": "681daacede130bddf45fd0c6"
  },
  "sku": "125998",
  "brand": "President",
  "count_unit": "Item",
  "department": "Specialty Cheese",
  "dimension_each": "L 1\" x W 1\" x H 1\"",
  "discount": "",
  "empty": true,
  "href": "https://shop.kimelo.com/sku/cheese-brie-60-frozen-22-lb-125998/125998",
  "images": [
    "https://d3tlizm80tjdt4.cloudfront.net/remote_images/image/7738/small/5b41b3664d4c670debf38cd6901d14461ebc988399e19127ae.jpg"
  ],
  "item_counts_each": 1,
  "name": "Cheese, Brie, 60%, Frozen, 2/2 Lb 125998",
  "popularity_order": 90,
  "price": 18.33,
  "pricePer": 4.58,
  "price_each": 18.33,
  "price_order": 78,
  "price_unit": "lb",
  "relateds": [],
  "showImage": "https://d3tlizm80tjdt4.cloudfront.net/remote_images/image/7738/small/5b41b3664d4c670debf38cd6901d14461ebc988399e19127ae.jpg",
  "text": "Cheese, Brie, 60%, Frozen, 2/2 Lb (SKU 125998) is a specialty cheese from the brand President. It belongs to the Specialty Cheese department. Each item weighs 4 lbs and has dimensions of L 1\" x W 1\" x H 1\". The price for each unit is $18.33, with a price per pound of $4.58/lb. No related cheeses are listed, and there are no current discounts for this product. The cheese currently has no stock available in the shop. For more information or images, visit https://shop.kimelo.com/sku/cheese-brie-60-frozen-22-lb-125998/125998. Its price order is 78 and its popularity order is 90.",
  "weight_each": 4,
  "weight_unit": "lbs"
},
{
  "_id": {
    "$oid": "681daacfde130bddf45fd0c7"
  },
  "sku": "125686",
  "brand": "Galbani",
  "count_unit": "Item",
  "department": "Cheese Loaf",
  "dimension_each": "L 1\" x W 1\" x H 1\"",
  "discount": "",
  "empty": true,
  "href": "https://shop.kimelo.com/sku/cheese-mozzarella-loaf-thin-slice-fzn-61-lb-125686/125686",
  "images": [
    "https://d3tlizm80tjdt4.cloudfront.net/remote_images/image/5949/small/d23620a3a0f21afb9281850456bf3598285654e87ef638e32e.jpg"
  ],
  "item_counts_each": 1,
  "name": "Cheese, Mozzarella, Loaf, Thin Slice, Fzn, 6/1 Lb 125686",
  "popularity_order": 91,
  "price": 7.95,
  "pricePer": 0,
  "price_each": 7.95,
  "price_order": 93,
  "price_unit": "lb",
  "relateds": [],
  "showImage": "https://d3tlizm80tjdt4.cloudfront.net/remote_images/image/5949/small/d23620a3a0f21afb9281850456bf3598285654e87ef638e32e.jpg",
  "text": "Cheese, Mozzarella, Loaf, Thin Slice, Fzn, 6/1 Lb (SKU: 125686) is a specialty cheese loaf product from the brand Galbani, categorized under \"Cheese Loaf.\" This product consists of 1 item per unit, with a total weight of 6 lbs per loaf. The dimensions of each unit are L 1\" x W 1\" x H 1\". The current price for each loaf is $7.95, with a price per pound listed as $0/lb. There is no discount currently applied to this product. The product is out of stock at the shop (empty: true). For more details, you can visit the product page at https://shop.kimelo.com/sku/cheese-mozzarella-loaf-thin-slice-fzn-61-lb-125686/125686.",
  "weight_each": 6,
  "weight_unit": "lbs"
},
{
  "_id": {
    "$oid": "681daad0de130bddf45fd0c8"
  },
  "sku": "112065",
  "brand": "California Gold",
  "count_unit": "Item",
  "department": "Cheese Loaf",
  "dimension_each": "L 1\" x W 1\" x H 1\"",
  "discount": "",
  "empty": true,
  "href": "https://shop.kimelo.com/sku/cheese-mozzarella-wmlm-cali-gold-loaf-fzn-86-lb-112065/112065",
  "images": [
    "https://d3tlizm80tjdt4.cloudfront.net/remote_images/image/7214/small/e9ab65ec35fd13418c56e43a697f0cd6f2464279cf92c5e10b.jpg"
  ],
  "item_counts_each": 1,
  "name": "Cheese, Mozzarella, Wmlm, Cali Gold, Loaf, Fzn, 8/6 Lb 112065",
  "popularity_order": 93,
  "price": 48.09,
  "pricePer": 1,
  "price_each": 48.09,
  "price_order": 47,
  "price_unit": "lb",
  "relateds": [],
  "showImage": "https://d3tlizm80tjdt4.cloudfront.net/remote_images/image/7214/small/e9ab65ec35fd13418c56e43a697f0cd6f2464279cf92c5e10b.jpg",
  "text": "Cheese, Mozzarella, Wmlm, Cali Gold, Loaf, Fzn, 8/6 Lb (SKU: 112065) is a cheese loaf from the California Gold brand, categorized under Cheese Loaf. Each item weighs 47 lbs with dimensions of L 1\" x W 1\" x H 1\". The unit price is $48.09, and the cost per pound is $1.00/lb. At present, this cheese is not available in the shop. There are no related cheeses listed for this product. The item is ranked 47th by price and 93rd by popularity. Preview and reference images are available at the provided URLs, and detailed product information can be found at the link: https://shop.kimelo.com/sku/cheese-mozzarella-wmlm-cali-gold-loaf-fzn-86-lb-112065/112065.",
  "weight_each": 47,
  "weight_unit": "lbs"
},
{
  "_id": {
    "$oid": "681daad0de130bddf45fd0c9"
  },
  "sku": "112075",
  "brand": "California Gold",
  "count_unit": "Item",
  "department": "Cheese Loaf",
  "dimension_each": "L 1\" x W 1\" x H 1\"",
  "discount": "",
  "empty": true,
  "href": "https://shop.kimelo.com/sku/cheese-mozzarella-pslm-cali-gold-loaf-fzn-86-lb-112075/112075",
  "images": [
    "https://d3tlizm80tjdt4.cloudfront.net/image/13863/image/sm-3e26ef88c6dc801ad4d041ef812a9c7d.png",
    "https://d3tlizm80tjdt4.cloudfront.net/image/12883/image/sm-2d47b5330ce18c62f204eb29f5a6a1a7.jpeg"
  ],
  "item_counts_each": 1,
  "name": "Cheese, Mozzarella, Pslm, Cali Gold, Loaf, Fzn, 8/6 Lb 112075",
  "popularity_order": 94,
  "price": 124.51,
  "pricePer": 2.59,
  "price_each": 124.51,
  "price_order": 8,
  "price_unit": "lb",
  "relateds": [],
  "showImage": "https://d3tlizm80tjdt4.cloudfront.net/image/13863/image/sm-3e26ef88c6dc801ad4d041ef812a9c7d.png",
  "text": "Cheese, Mozzarella, PSLM, Cali Gold, Loaf, FZN, 8/6 Lb (SKU: 112075) is a specialty cheese loaf produced by the California Gold brand. It belongs to the \"Cheese Loaf\" department and each item weighs 48 lbs with dimensions of L 1\" x W 1\" x H 1\". The cheese is sold for $124.51 per item, which is equivalent to $2.59 per pound. The cheese is currently out of stock at the shop. There are two reference images available: [image1](https://d3tlizm80tjdt4.cloudfront.net/image/13863/image/sm-3e26ef88c6dc801ad4d041ef812a9c7d.png) and [image2](https://d3tlizm80tjdt4.cloudfront.net/image/12883/image/sm-2d47b5330ce18c62f204eb29f5a6a1a7.jpeg). No related cheeses or discounts are listed for this SKU. For more information, visit the product page at https://shop.kimelo.com/sku/cheese-mozzarella-pslm-cali-gold-loaf-fzn-86-lb-112075/112075. This cheese ranks 8th in price and 94th in popularity within its category.",
  "weight_each": 48,
  "weight_unit": "lbs"
}]